"","X","his_data_2012.his_all_comments.textOriginal"
"136",136,"@sam miles ... Then explain Canadian Indians (genocide) and the British ... Sucks when people pay attention - huh"
"137",137,"The tool used to kill is completely immaterial to WHY. Even if you could keep a gun from being available, they will just use something else. And yes there are things far more dangerous than bullets. This country needs to get over it's gun paranoia. That is not a solution."
"138",138,"""According to the United Nations Office on Drugs and Crime, Honduras has the highest rate of intentional homicide in the world, with 6,239 intentional homicides, or 82.1 per 100,000 of population in 2010.""
-Their website, linked to from Wiki. Read it yourself. 
Honduras gun ownership: 6 guns per 100 people. Dwarfed by the US 88.82 per 100 in your own numbers. Gun proliferation, nor availability creates homicide or any other crime. Simple fact. Deal with PEOPLE not their tools. "
"139",139,"Video Games"
"140",140,"@Justin Sarloos So which one did you like best? *grabs popcorn*"
"141",141,"The british? The founding of the 13 colonies but the american colonists were the ones who wanted to push out and caused all of the problems with indians the british actually wanted to stop them pissing off the indians so they could take some more of there troops out of there
"
"142",142,"Omg it's not gun control we need it's health care and common sense for the mentally challenged. It's idiots who blame the innocent instead of shedding the light on Obama which now a days for a mental child to get the care they need must do a certain crime to get attention"
"143",143,"All comes back to parenting and education ..., and no one wants to hear that noise"
"144",144,"Yeah yeah - the video games and movies !

No no - not the Psychotrops, mental health, and such, or gun free zones ... Nope

I'm 36, and have yet to jump off the side of a cliff with a sign that says 'help', or hit a friend over the head w/ a mallet or frying pan ... Maybe I'm just one of the few ????"
"145",145,"So according to the comments I been reading this list is just distasteful and will only promote more mass shootings. So what about Watchmojo Top 10 list of US Serial Killers? Look this video was not made to condone nor glorify the actions committed by these men or to even rank them by which was the bloodiest or had the most casualties. This site covers trends that is shaping this our culture from movies sequels to crazy cults. We can ignore that this is part of society and attempt to solve it. "
"146",146,"Elizabeth .... Take-Off. You don't live in fear of your government wankers, because most of you are already good little brainwashed domesticated British bitches."
"147",147,"Really? The United Nations Office of Drugs and Crime disagrees.
The rate of private gun ownership per 100 people
United States 88.82
United Kingdom is 6.72
Canada 23.8
Switzerland 45.7
The annual rate of homicide by any means per 100,000 population
United States 4.96
United Kingdom 1.2
Canada 1.8
Switzerland 0.70
The annual rate of firearm homicide per 100,000 population
United States 2.98
United Kingdom 0.03
Canada 0.50
Switzerland 0.52
"
"148",148,"Actually,  68% of the Canadian population live in the golden horseshoe area of Ontario, not 90%. Also  Canadians may visit, for the most part because our dollar is close to par with the US for the first period in 20 years, but they still choose live here - why?  Also, this tourism was before the Connecticut shooting  - I am taking your word on numbers so let's see what happens next year.  I don't live in fear as Canada doesn't have the second highest murder rate in the western world - you do."
"149",149,"I keep hearing this story, but then why aren't other western countries like Canada, the UK and Australia afraid of their governments?  They all have strict gun laws. Is the US not becoming a bit paranoid since you are a democracy along with these other countries?"
"150",150,"james , cho , eric and dylan were all victims of brainwashing "
"151",151,"i think the american society built this"
"152",152,"not to mention music has no effect on peoples behavior "
"153",153,"the columbine kids didn't listen to marlin mason so they can't blame him for this. the kids at columbine listen to rammstein not marlen manson"
"154",154,"And there has never been one gun ban in the entire world that actually decreased the over-all homicide rate. The only statistic that a gun control measure has ever reduced is suicide by fire-arm. And over-all suicide stayed level anyway. This paranoid knee jerk reaction to shootings is not the answer. Focus on the PERSON and what went wrong with him. The gun is innocent. "
"155",155,"Thank you"
"156",156,"Kinda pisses me off that they would put an ad on this video, forget the fact that videos and news reports such as this give monsters and killers a national and sometimes world stage. Take off ads that gain you money from, in essence, people's deaths, and stop giving these murderous bastards so much attention. "
"157",157,"Apparently Canadians feel safe enough. Do you know where 90% of Canadians live? Within 100 miles of the American border! Did you know that Canadian tourism into the U.S. has reached record highs this year? I'm sorry that you live your life in fear, but I'm glad most Canadians are not as ignorant."
"158",158,"Sorry but you can't blame videos games, movies, music, culture for shootings. They'll always happen. Unfortunate but true"
"159",159,"""use bombs to cause anarchy""

I'm done."
"160",160,"Elizabeth you seem to have your panties in a bunch...I normally am not a male chauvinist but your ignorance is at a pretty high level.  If you can't understand how a well armed civilian population protects it from the govt. you need to stfu and learn a little common logic.  Murder rate has nothing to do with gun rights.  There are many factors that go into the murder rate...The US has more GDP then all those countries combined...that does not mean money causes murders either "
"161",161,"These gun rights protect us from an overbearing government.  Freedom is not free, someone has to defend it.  Now don't dont you worry your pretty little head.  Someone will think for you"
"162",162,"OK, I will go on point.  We Canadians do NOT feel safer knowing how lax gun laws are in the states.  Many people are becoming afraid to travel there as a result of the significant number of shootings that take place. The data shows that your gun culture is not a safe one, and it doesn't take much thought to see this.  I am not against a free society, and I am not saying that the constitution should be scrapped.  You exaggerate the issue when it is just one thing - too many guns easily available."
"163",163,"delete this video asap. you are rating mass murder you simple minded fucks."
"164",164,"i remember just before winter break my school was thraetened with a shooting 2 days later they found one student with a fire arm in his bag and he wouldnt give any other names i didnt go to school the day the shooting was supposedly gonna take place but ill find out what happend when i go back"
"165",165,"What are the ""Top Ten Human Destructions"" in the world?...No. 1 is...The damn media a.k.a. THE MEDIA SHITFEST!!!"
"166",166,"you now what if people who are about to do this I've got a message, you are sick people piecees of crap and I play gat mw2 mw3 modern warfare I haven't done stuff like this it happens because people have sicknesses and are bullied or don't get enough attention"
"167",167,"that happened on the 14th while this was posted on the 5th."
"168",168,"Reminder? THIS IS WHAT THEY WANT!  Scum like you who post this stuff and the web site that made the top 10 are culpable for future events. The perps should never be named to give them the glory they seek.

There's remembering the past and there's exploiting the past. Scum like you exploit it and hide behind a noble purpose. Hope you sleep well at night the next time this happens because some other nut job wants to make a top 10 list."
"169",169,"What about the Sandy Hook Shooting? That was pretty heart stopping to not just the US but the whole world.
"
"170",170,"I agree Sam what the hell the person commintating has no pity"
"171",171,"this is fucking ridiculous how the fuck can you justify making a TOP TEN LIST of fucking massacres.... this is disgusting"
"172",172,"Wait how did u publish this on the fifth of december and talk about the newtown shooting when it happend on the 14th... time travlers!"
"173",173,"Was my argument intended to support your data? No. What is your point with these numbers, other than the shock value?"
"174",174,"Connecticut,Newtown 27 killed cant forget that even though this was two weeks before"
"175",175,"@3:31 .....wut. "
"176",176,"So my question is still, how does your argument support the data below?
United Nations Office on Drugs and Crimes - List of Countries by Intentional Homicide Rate:
US - 4.2 deaths per 100,00 (count - 12, 996)
Canada - 1.6 per 100,00 (count - 554)
UK – 1.2 per 100,00 (count – 722)
Australia – 1.0 per 100,00 (count – 229)
Sweden – 1.0 per 100,00 (count – 91)
Japan - 0.3 per 100,00 (count - 442)
"
"177",177,"""Top 10"" for that subject? Sick. Just sick. Shame on you Mojo. "
"178",178,"hes actually a pretty good musician. Im not into goth rock at all but he is def my fav of them all. Hes a genious"
"179",179,"crazy how after this was made the most violent one ever happened. RIP CHILDREN OF GOD"
"180",180,"the new number 1 is sandy hook "
"181",181,"well, she was probably the type of person that woudnt let hereself beleve ever, that here husband did something bad
so she is searching for anything that might make up for what he did
the motive for such thinking is kinda love
and well yea, love has a darker side and makes people crazy(or more specific, less rational), thats already prooven thats for sure"
"182",182,"I know you don't understand. Even some Americans don't understand, and that's shameful. We are protecting our rights as free Americans. Countries without these basic rights will never comprehend how critically important they are to a free society, in the interest of remaining free. You may condemn us for our ""gun culture,"" and that's fine. But the truth is, you folks up north would be far less secure if not for all of the ""gun nuts"" here."
"183",183,"I just don't see what these rights are protecting - is it the school shooting examples below? This is not close to an exhaustive list.
Chardon Ohio School, Oxford CT High School, Columbine High,  Sandy Hook Elementary School, Virginia Tech School, Baltimore School, Heritage High School, Mime School, Oakland School, A & M University, Texas School, Cleveland High School,  Santana High School, Red Lake Senior High School, Oikos University, Westfield High School"
"184",184,"In comparison to other countries in the civilized western world, the US gun laws are somewhat lax.
United Nations Office on Drugs and Crimes - List of Countries by Intentional Homicide Rate:
US - 4.2 deaths per 100,00 (count - 12, 996)
Canada - 1.6 per 100,00 (count - 554)
UK – 1.2 per 100,00 (count – 722)
Australia – 1.0 per 100,00 (count – 229)
Sweden – 1.0 per 100,00 (count – 91)
Japan - 0.3 per 100,00 (count - 442) - not in the western world but interesting nonetheless
"
"185",185,"United Nations Office on Drugs and Crimes - List of Countries by Intentional Homicide Rate:
US - 4.2 deaths per 100,00 (count - 12, 996)
Canada - 1.6 per 100,00 (count - 554)
UK – 1.2 per 100,00 (count – 722)
Australia – 1.0 per 100,00 (count – 229)
Sweden – 1.0 per 100,00 (count – 91)
Japan - 0.3 per 100,00 (count - 442)
"
"186",186,"It would be in the top 3 with VT and Columbine.  I still think Columbine was so unique in nature and the fact that had the bombs worked hundreds of people would have died makes it more infamous."
"187",187,"i hope your listening all you xbox nerds"
"188",188,"wow 1 week later; sandy hook"
"189",189,"""I ask, sir, what is the militia? It is the whole people except for a few public officials.""

- George Mason"
"190",190,"This video was posted 9 days before Sandy Hook."
"191",191,"You do know what the word ""fact"" means, right? Gun-lovers or not; Americans are defending our freedoms. We have an undeniable right to own and carry guns in order to defend ourselves. Current events, as tragic as they are, do not change the fact that our rights are protected and may not be taken away, restricted, or otherwise infringed. "
"192",192,"Not sure if trolling or just plain stupid...."
"193",193,"we need to ban cars, restaurants, movie theaters, diners, jobs, women, representatives, colleges, schools, Marilyn Manson,  IT MUST STOP!!!!!!"
"194",194,"Ahem weres newtown sandy hook"
"195",195,"US Gun laws are far from lax. Some countries mandate gun ownership and have some of the lowest homicide rates. 
US has about 88 guns per 100 People. Honduras is the murder capital of the world, with just 6 per 100.
""European nations with the lowest rates of gun ownership (5,000 or fewer guns per 100,000 population) have a combined murder rate three times higher than that of the nine nations with the highest rates of gun ownership."" 
-Harvard Journal of Law & Public Policy "
"196",196,"Now what Manson did right there has got to be one of the most INTELLIGENT responses out there when it came to massacres such as these."
"197",197,"look up sweeden"
"198",198,"i love how this video plays such happy music...
"
"199",199,"OK, so let's look at the facts:
US - lax gun control laws, second highest murder rate per capita in the civilized western world
Canada - strong gun control laws, way down the list of murder rates per capita
Japan - completely banned guns, virtually no murders per capita
Just what are gun lovers defending??!!
"
"200",200,"All this because you want the second amendment, seems to me your not protecting your selfs very well."
"201",201,"Sad that most of these events happened in the last 22 years."
"202",202,"oh look, these mass shooters get to be immortal. more glorification from the media.


""top 10"" seriosuly? what the fuck is this?"
"203",203,"Manson is a fucking genius. I don't give a shit how Christian you are. His songs have the most witty lyrics. "
"204",204,"The Columbine massacre even got its own indie game"
"205",205,"I was about to put that!!!"
"206",206,"then 9 days later came the Connecticut shooting :("
"207",207,"Why does everyone only remember rachel? Oh, that's right, because she has a pretty face. fucking stupid rachel's challenge bs."
"208",208,"this is so tasteless"
"209",209,"omg people need to grow up cause if u go out and shoot people that makes ur life worse
"
"210",210,"Chicken nuggets can cause rage. U didnt see that video of that fat bitch?"
"211",211,"What Marilyn Manson answered has to be some of the best answers you can say. Not a fan of him. At all. Yet you gotta respect the guy for what he says."
"212",212,"What set Columbine apart was that it was one of the first school shootings to unfold on live television. Not that it makes tragedies before and after it any less horrible, but the reason it gets that it used as comparison because of how it unfolded on live television and how the media portrayed it for the public. For an American high school, it's still considered the deadliest. "
"213",213,"Fucking Hassan piece of shit. Fucker is still getting paid Major, he keeps having his trial stall. He is getting a judge in trouble for the judge ordering him to shave his beard. Which is  an Army mandated thing to do. I have to do it everyday. And he should be fucking dead by now."
"214",214,"You probably didn,t read ""Infamous"" in the title..."
"215",215,"I can't help but wonder, why is it that the media widely claims that Columbine was the most shocking and infamous shooting? School shootings weren't unheard of even back then, and the incident didn't result in the most deaths at that point either. Now I'm not saying the victims of Columbine don't deserve as much remembrance as any others--ALL of these events were horrible tragedies--I just keep wondering what sets Columbine apart and why other past events are never mentioned."
"216",216,"You'll get no argument from me with that statement. I guess when I hear of mass numbers of people being brutally murdered I'm just never prepared for it, even though I know these things happen. "
"217",217,"Prehaps not a good idea to call it ""Top Ten Mass Shootings""

Some people might take offence but that"
"218",218,"Sadly I'm not sure that is there a real reason to every killing spree but now days I think some are just wanting their 15 minutes of fame.
As for the latest shooting my sincerest participations to those whom lost loved ones in the shooting. "
"219",219,"Well as long as we are human we are capable of killing others just because our violent behaviour. Everyone has some violence inside of them but some know how to suppress it without harming or killing another human being(personally I do it with competitive sports and video games), but the right circumstances even the pacifist person can turn in to crazed gun man in a split second. 
That is the sad truth, sorry."
"220",220,"oh ok"
"221",221,"On Purim, Feb. 25, 1994, Israeli army officer Baruch Goldstein, an orthodox Jew from Brooklyn, massacred 40 Palestinian civilians, including children, while they knelt in prayer in a mosque. Goldstein was a disciple of the late Brooklyn Rabbi Meir Kahane, who told CBS News that his teaching that Arabs are ""dogs"" is derived ""from the Talmud.""

Not geographically in the U.S., but Israel has more influence on US gov't policy than American voters, so it might as well be the U.S. "
"222",222,"Right on, we're all in this together."
"223",223,"I don't know how anyone could kill another human being."
"224",224,"This came out before,before....*cries so hard it floods house*"
"225",225,"usa is fucked up, media wants you to feel proud of your country and yet everyone outside usa knows how fucked up country usa is"
"226",226,"A lot of people there have guns. It's part of their culture."
"227",227,"Why in the world are most of these shootings in texas "
"228",228,"Bruce Wayne , I thought you were a detective? this was made and posted a week before the Connecticut elementary school shooting. Stop being so butthurt"
"229",229,"Oh ok well was Columbine like the wost high school shooting? I know its not the worst but is it still the most killed from a high school..I need to do some research I cant believe I dont know the Columbine story when its this famous. My aunt was telling me about it"
"230",230,"No, no, no. Fuck you ""WatchMojo"" this is disgusting. What the fuck is the point of this video? To remind us how terrible gun laws are in America? We fucking know you stupid cunts. Profiting from people's deaths to gain more Youtube views. FUCK YOU. You're no different than these gunmen. Who wanted fame by committing these acts and now they have it. You have you're sickening views. There is no point to this goddamn video other than you fucking worthless assholes to profit from it.  "
"231",231,"@Macconator2010 the shooting has actually changed the minds of many lawmakers, and more are for the ban of assault rifles and tougher restrictions on gun licenses. Obama just recently appointed Joe Biden to a new task force to deal with this issue, and will decide on what executive powers should be used."
"232",232,"Why wont the US come to their senses and have more strict gun laws like Australia"
"233",233,"Blame the parents.
"
"234",234,"This list is a joke. How does the Amish school shooting not make the list, but Aurora is #4?"
"235",235,"Dont blame video games"
"236",236,"no don't"
"237",237,"5:44 BOOM HEADSHOT!!!"
"238",238,"I live in Montgomery County and although was 4 at the time of the sniper can still remembers parts of the event. Sad times. Bless all those who lost a life."
"239",239,"Weird how this was posted, and about a week later....."
"240",240,"I know this video was put up before the Sandy Hook massacre, but what about the Portland mall shooting 2 days before it? Was this video up before that? "
"241",241,"How did Columbine beat out Virginia Tech? Come on! 38 dead vs 15 dead? whatever..."
"242",242,"Sandy Hook hadn't happened yet when this was made, and there probably isn't any video footage of a shooting from 1927.

V-Tech shooting was definitely deadlier than Columbine, but I think Columbine's effect on American culture makes it stand out the same way that Sandy Hook will stand out in the future, even though it was less deadly than V-Tech as well."
"243",243,"dc snipers were serial killers"
"244",244,"watchmojo..........c'mon!!!"
"245",245,"RIP to Sandy Hook victims."
"246",246,"Why is Columbine seem to always be mentioned when a new school shooting happens? I know it was bad enough but there are way worse school shootings like V-Tech,Sandy Hook, and The Bath school massacre is even worse then V-Tech...it happened in 1927 the guy killed 45 people including school children. So why is Columbine stand out? It may sound dumb but Im just wondering, I was only in 3rd grade when Columbine happened so I dont really remember...I should research  Columbine since I never have."
"247",247,"You were about 10 days late of the sandy hook massacre"
"248",248,"prob because that wasnt a massacre and the gunmens intentions were initially to robb a bank...most of these seem more random/pointless and sporatic
"
"249",249,"Unfortunately, it's videos like these that inspire lunatics, bullied or not, to commit these crimes. They love the fact that they're considered infamous."
"250",250,"Believe it or not, the world did exist before you were born.
Try reading a history book."
"251",251,"Did you know that the little girl who died in that 2011 massacre was born on the 9/11 attacks? She was gonna be 10 on the 10th anniversary."
"252",252,"I didn't say deaths wouldn't happen, I said the rate would go down.
and ""IF"""
"253",253,"New terrible shooting :( School in CN"
"254",254,"this is sad."
"255",255,"Two words. Bath Michigan. Look it up"
"256",256,"This always makes me wonder what if it happens to me considering I live in not the best neighbourhood and there is a lot of bullying at my school"
"257",257,"More like assault rifiles, consirding the conniticut massecare.
Assault rifiles are designed to kill people, for example look at the AK-47 or AK-74, these guns were designed especailly for millatary.
(Excuase my spelling, I can barely see. I haven't sleep't in 25 hours)"
"258",258,"then ban all weapon related material lol"
"259",259,"Americans shoot people for breakfast"
"260",260,"people will find a way to bring them in. then we all are defenseless "
"261",261,"
the dude's mother (in CT) should have taken him off psychiatric drugs. having those guns around made it easy for him, too. never heard of a woman who wanted not one but two semi-automatics-- and a sniper rifle."
"262",262,"People like this make me embarrassed to be part of the human race"
"263",263,"There's already tons of unregistered guns on the streets banning guns wont do anything"
"264",264,"If it were to be a mini documentary about mass shootings, then I'd say fair enough. 
But the fact that it's a top ten list... is tasteless. These kind of scenarios shouldn't be put into competition with each other... "
"265",265,"if everyone has a gun true everyone would think twice before killing someone... but if we ban guns, we don't even have to think about shooting "
"266",266,"Sadly only after a few days of posting, we have a new number one. The Connecticut elementary school killings."
"267",267,"Thumbs up if you cried while watching the video"
"268",268,"What a tasteless list..."
"269",269,"Yea you have a new one to add"
"270",270,"7. Why should I?

8. Well most of us don't

9. Then stop commenting to me

10. America is a place of immigrants, no one has been orginated from it, which means you can't use ""unamerican"""
"271",271,"This video has to get Updated"
"272",272,"i thought the same thing"
"273",273,"Better update this video. There's a new #1."
"274",274,"7. then shut your mouth
8. I have my licenses
9. I dont give a fuck about your finacial situation, just get out
10.how unamerican of you"
"275",275,"1. Over usage of ""...""
2. It's possible
3. USA has the strictest/most agressive police, I have ever saw
4. No you don't have the right to bare arms, you have to sign up for a licenses, go to a gun store verfiy it, etc
5. ""But, hunting, etc....""
6. I don't have $2,000 to move to a different country"
"276",276,"Your in the wrong country for that.... never gonna happen... never... and I'm proud to say I'm glad it will never happen...  Americans will always have the right to bare arms"
"277",277,"No, I haven't :l I wish I could visit other countries"
"278",278,"Guns anyone?"
"279",279,"Not really. Even countries that has strict gun still has something like this. Finland and Norway are good examples of that"
"280",280,"It was base off Ed Gein. A murderer in Wisconsin. "
"281",281,"Colorado after Columbine takes these things seriously"
"282",282,"Not really the worst school shooting in world happen in Russia "
"283",283,"""I wouldn't say a single word to them, I would listen to what they have to say, which is what no one did."""
"284",284,"Do people in U.S just pop guns out of Nowhere?? They're not supposed to have weapons!!"
"285",285,"surprised the st valentines day massacre did not make it on here sure it did not have the highest body count but the list says infamous"
"286",286,"The 9 year old girl was former Phillies pitcher Dallas Green's granddaughter...the horrible irony is that she was born on 9/11."
"287",287,"I've eaten thousands of McNuggets and I've never killed anybody bro. "
"288",288,"The last guy is gay!"
"289",289,"3:04 gimme mi god damn mc-nuggets!!!"
