"","X","his_data_2012.his_all_comments.textOriginal"
"290",290,"I went to a Midnight Screening of TDKR. When i heard about what happened in Aurora. I shit my pants"
"291",291,"hatred towards women..... I know that feels bro"
"292",292,"we're all human"
"293",293,"#2 is proof positive that anti-gun laws are worthless. Criminals are going to still get guns AND use them regardless of what limitations are set on law abiding citizens. "
"294",294,"How are these infamous?"
"295",295,"You must live with your eyes closed."
"296",296,"gun makes it easier to kill, but the problem isnt with guns, its with someone killing someone else. "
"297",297,"so sad...makes me think about the horrible person i must be in any GTA game....im a monster!"
"298",298,"Only in the states!"
"299",299,"Check y vids"
"300",300,"I didn't say all deaths would go away, I said 60% of gun deaths. Not the whole 40%. Now stop spamming me"
"301",301,"Some criminals can make guns too you know."
"302",302,"This, or your idea, but I don't think giving a 4 year old a gun is a good idea"
"303",303,"It's pretty twisted to make a top 10 of shootings, but they're pretty damn interesting"
"304",304,"I love that film!"
"305",305,"i think if every1 had guns people would think twice to kill people."
"306",306,"Wtf????"
"307",307,"yea that statistic is a load of BS. though"
"308",308,"R.I.P"
"309",309,"Has anyone seen the movie Zero Day? It's based off the Columbine Shooting and god will it stay in your mind forever."
"310",310,"2004 aurora shooting? Wtf I am guessing the dates are fucked up?"
"311",311,"you never know how sweet life is until it is gone the deaths only make us stronger the failed at what they did and we fix what they did"
"312",312,"Look, guns count as 40% of deaths in the U.S.A, It would make massecaring 99.99% harder...."
"313",313,"Amazing how quickly one forgets about these tragedies"
"314",314,"In many studies that go largely unreported, when gun control rises, when law abiding citizens are prohibited from owning their firearms, violent crime goes up.  When more law abiding citizens are allowed the right to own their sidearm, violent crime goes down.  Violent crime includes, but is not limited to, gun crimes.  Criminals do not obey the law, that's why they are criminals.  Learn more about guns, do not fear the tool, fear the criminal."
"315",315,"46)()&&$),?!!'mbvczaqryujnnbbbcxzss.,,?))65432246790@$)"
"316",316,"No, no it isn't.  If we would ban guns, death rate would probably go up.  The only way for peace is for either everyone to have a gun, or for no one to have one."
"317",317,"I gave you a name on your account.  I can't post links.

Also, I'm not the one flagging your videos as spam.

"
"318",318,"ya! blame it on marilyn manson "
"319",319,"Still no list of  guncunt pro-gun channels?  Thanks for telling me that you mark my comments as spam.  Shows me that not only are you afraid  of not having a gun but you are also afraid of ideas.  You are one giant cowardly hypocritical ass hole.  You bitch about others talking about taking away YOUR 2nd amendment right to a gun while you take away my right to speak out.  From now on I will go back weekly to every video on which I make a comment and repeat it.  Words are more powerful than guns."
"320",320,"25 to life x 6 = 150 years without parole if he lived up to that age(lol) he would have a chance to be paroled."
"321",321,"You can't massacre a group of people with  knives unless you are a ninja. You can run over a bunch of people but you have to be really good at planning. ANYTHING  can be a weapon if you are smart enough. Guns however in the wrong (stupid) hands can hurt more people than any of those you listed, if you are going on a spree it doesn't matter you you suck at aiming a gun as long at you hurt people."
"322",322,"It does happen is based on real life events on the first beginning movie, the sequels were just made up story "
"323",323,"Thats what I just said in the first comment"
"324",324,"That may be, but it hurts those who obey the law more than criminals."
"325",325,"No, it wouldn't, guns count as 40% of deaths"
"326",326,"no killings would go up. using a gun is traceable without a gun people will just use switchblades and stab you in the street in public and pull it back unto his sleeve and he would get away with it"
"327",327,"most of the shooters were addicts to legal drugs "
"328",328,"Number 9 is my hometown :("
"329",329,"""isnt really infamous""?
do you know what infamous mean "
"330",330,"Of course such incidents should be remembered. But don't you think that it is at least in some way wrong to present mass murders as a top 10? Though it might not be intended that way here, a top 10 implicitely renders every placing successively superior to its antecedent in some way, as they are in a transitive relation. That of course contradicts the purpose of commemoration, as it can be taken as glorification of the macabre."
"331",331,"It is hard to kill with out gun."
"332",332,"I thought the Unabomber would be included"
"333",333,"These shootings were a huge part of our history, and like any piece of history we should learn from it. Why not educate people about these so they can be prevented, rather than just pretending like they never happened? MAJOR props to you watchmojo, for doing this. I honestly am glad they did, and do not find it offensive. History is history, weather good history or not. And we need to learn from it. "
"334",334,"Must are from bein bullied or just had enough"
"335",335,"my favoire it the colombine high shooting,that is my top number 1mass shooting"
"336",336,"compare gun crime in the UK with the USA (scale it down to account for the population difference). Your welcome."
"337",337,"Number 9 isn't really infamous, the news even got to the netherlands. And normally we don't get much news from the USA."
"338",338,"Damn, the last couple of Watchmojo videos have all had something to do with death
"
"339",339,"i love how most ppl that are anti gun  are also pro abortion . . . . .."
"340",340,"just saying, i guessed number 1. These events are so sad"
"341",341,"i was glad to see that final part with manson because he gets a bad wrap from people. he is actually a very intellengent person and i think he would make a wonderful teacher or principle because he would find out the root of childrens the problems and FIX THEM."
"342",342,"where's the Hollywood shoot out at? That one became the reason why cops started to carry semi automatic rifles instead of shotguns."
"343",343,"Here in Finland we have stricter gun laws, but we've had our school massacres too sadly. Banning guns isn't the solution, they who want guns will get them anyway. Like Dave Chapelle said, let's make bullets cost like 10 000 dollars each."
"344",344,"I see all these comments talking about ""Banning Guns"", criminals will still get them. How much stuff is illegal that criminals get? Cocaine, Heroin, Etc...If we ban guns, lets ban knives, vehicles, prescription drugs since all those tend to kill people. The silliness of a country that would rather blame an inamiate object other than insane piece of garbage is quite odd."
"345",345,"It would make it HARDER for them to get access to a gun AND ammo"
"346",346,"@amapoorguy * Guns don't kill people"
"347",347,"With guns..."
"348",348,"America and Guns :("
"349",349,"If we ban guns, then criminals would get them the usual way they do things... ILLEGALLY!"
"350",350,"Damn i hate when people blame violent games or movies as the reason people do these kind of things, what about the millions of people who also play and watch those movies and dont go around killing people, its not rap, movies, games not even broken homes i come from a broken home and i haven't killed anyone in about 22 years but hey maybe im doing something wrong. Some people are just fucked in the head from the day they are born."
"351",351,"But you can't argue with the fact that guns make killing people a lot easier, especially on a large scale. Guns made these mass killings possible, no other available weapon would have achieved the same effect."
"352",352,"Yea but u can't easily massacre people with a knife or even a one shot hunting rifle can u idiot"
"353",353,"Trenchcoatmafia ftw!"
"354",354,"I fully agree, and I LOVE my second amendment, but murder rates would go down if there were no guns."
"355",355,"Yes it may be. I don't think one should be ranking tragedies."
"356",356,"Fuck james holmes "
"357",357,"... Rachels challenge, that goes to different schools and urges kids to take a stand. When I was in 7th grade the Rachel's challenge came and the whole school went to the presentation, it was so moving that some people were either in or near tears including myself. I have never heard a story so tradgec in my life, and that goes with all of the incedents mentioned in the vid. It's so sad that these things have happend... Anyway that's just an example and i'm sorry i had to use two comment boxes."
"358",358,"I'm sorry to kinda inturupt but this goes in a similar context for what you guys are saying. Sometimes in the end good things come out to help prevent these same massacres from happening again. For example the infamus Columbine shooting. The first person to die that day was Rachel, she was just sitting outside, eating junch when the shooting started. Yeas before this she drew a outline of her hand making a pledge to stop bullying and things of that nature. The effects of her story sparked..."
"359",359,"""Japan will never invade mainland America because behind every blade of grass would be another American with a gun"" - Admiral Yamamoto, 1942"
"360",360,"i think its better to celebrate a birthday than a death of someone you love and care about "
"361",361,"Holy the Lubys one happened 5 days after I was born"
"362",362,"Texas chainsaw massacre film is based on part of the life of Ed Gein there was never a psycho family with a mentally disable kid with a chainsaw"
"363",363,"What happen to the Texas chainsaw massacre"
"364",364,"i remember the 2011 shooting in arizona. that little girl was portrayed  in a episode of E60. not tomention i knew her parents very well"
"365",365,">Implying support of the NRA is ""brainless"""
"366",366,"Where do they get ammo?"
"367",367,"well you know criminals will defiantly fallow the law, and totally not gun smuggle guns and won't leave law abiding citizens defenseless... use your head dumbass "
"368",368,"why make a top 10 of this
"
"369",369,"That would stop people from buying guns from gun shops, we do need them for the economy... If we stop selling ammo too"
"370",370,"Blame the NRA stupid gun laws intended to shield criminals and idiots from punishment. More Gun deaths, more public fear, more gun sales. If you still support the NRA policy of selling guns to idiots with no limits on numbers, types, magazine size, the gun show loophole and all that... I have a new name for what you are: “GUNCUNT”.If you don’t like that, well too bad! I don’t like what has happened to America thanks to your brainless support of the NRA. So damn the NRA, damn guns, damn guncunts."
"371",371,"Y U NO make your videos 720p?"
"372",372,"I don't understand can someone please explain how someone can have 6 life sentences ?"
"373",373,"Thats deep man..."
"374",374,"Yeah, because criminals obey the law."
"375",375,"Our videos look back at anniversaries, birthdays, deaths etc., and tomorrow Dec 6th marks the anniversary of the 1989 massacre at L'École Polytechnique in Montreal.  Of all the videos we could have produced, this seemed like a good way to educate and inform audiences on the history of massacres.  Is it better to outright ignore the anniversary?"
"376",376,"i live in tucson. You guy have no idea how hard that shooting hit the town. "
"377",377,"Yeah I watched it after I commented on this video"
"378",378,"seriously? What is the matter with you?"
"379",379,"I thought it was about the game infamous hahhaha"
"380",380," he/she is an idiot"
"381",381,"You're five times more likely to die from falling out of bed than you are getting killed in a mass shooting. Fuck gun laws."
"382",382,"you know im tired of you faggets that always say flirst!!! this video is serious and you probally like i wanna be popular on youtube so you know what fuck you"
"383",383,"Every time I c a commercial 4 DKR I think about the Aurorans that were gassed and shot"
"384",384,"Sheeple.... gotta love how they think criminals follow laws. HAHAHAHAHA!!!!"
"385",385,"fuck that im never visiting america to many pyschos with easy access to guns"
"386",386,"Glorifying murders only incourages more."
"387",387,"oh i mean 4"
"388",388,"Man its so scary, i live an hour away from where 3 happened and i have a friend who had almost gone to the very theater it happened. its hard to imagine what drives people to the point of doing such terrible things"
"389",389,"*GASP*"
"390",390,"Well I mean that will do respect.. "
"391",391,"Why would a beard delay a trail? Who cares if the guy got a beard or not"
"392",392,"Not sure if too soon.......or too funny....."
"393",393,"#4) in a perfect world Batman would have shown up an stopped him.... But no.. "
"394",394,"Yeah well the Republican Party will see to it that it never happens. "
"395",395,"For your husbands craze WOW"
"396",396,"that dumb bitch tried to sue mcdonalds because her husband committed a rampage and killed 22 people inside of a mcdonalds. Her explanation was that the nuggets made her husband crazy.  God it pisses me off when people say ugly people like me should not reproduce no its stupid morons like that lady that should not reproduce. "
"397",397,"Really?! Blaming a chicken MCnugget for your husbands"
"398",398,"No, believe me you don't. I live in a country where gun laws are insanely strict and trust me, the possibility of having a firearm in your self-defense gives you a great advantage over an assailant. Guns kill people everywhere even though they are illegal, look at Brazil for example."
"399",399,"Oh wow... I kinda like what Marilyn Manson said at the end of the video. I just hope he isn't supporting what the kids did"
"400",400,"I'm scared i live 10 minutes away from Virginia Tech!!!!!"
"401",401,"Guns make it 99.99 Percent easier to kill someone, we take anyway guns, people have a chance for self defence."
"402",402,"Seems a little grotesque to rank events such as these in an order. What makes one tragedy worse than another?"
"403",403,"guns dont kill people, people kill people. regardless of having a gun or not gun, people will still kill"
"404",404,"If we would ban guns, death rate would go down by 60% But, hunting, etc...."
"405",405,"Too bad that people couldn't watch the movie"
"406",406,"Regardless of the gun control argument, I feel extremely sorry for the victims of these senseless attacks. All they did was wake up and try to live their normal lives only to be shot down for no real reason."
"407",407,"maybe you should seek help"
"408",408,"Through* Your*

and hes a sick fuck for commenting first on a video which happened to be about shootings?

re-evaluate your life"
"409",409,"Guns don't kill people psychos kill people."
"410",410,"What about knives control when people get killed by knives."
"411",411,"How did they let an islamist into the us army?"
"412",412,"How about first to fuck off."
"413",413,"I agree they like to make us feel warm and fuzzy inside"
"414",414,"you really like to do grim top 10s dont you"
"415",415,"those Mcnuggets are addicting HA"
"416",416,"bloop"
"417",417,"Why would you say that on such a thing?!"
"418",418,"gay"
"419",419,"First!!!!
"
