"","X.1","X","all_comments.authorDisplayName","all_comments.likeCount","all_comments.textOriginal","all_comments.publishedAt"
"952",952,952,"M3MPHI5",0,"you cant cc a rifle window lickers..and if the said person did they had to break the rifle dwn and rebuild..which mens you civilians suck at judging threats..they should make a app for common sence..lol maybe 1 day the clinton news network will talk like grown folks vs being puppets/push overs..keep trying....","4/3/18"
"953",953,953,"SIP871",0,"Thank god, i don't live in america","4/3/18"
"954",954,954,"LPS Smarties",0,"This is heartbreaking","4/3/18"
"955",955,955,"stockframebangin",0,"Don lemon is a fucking idiot","4/3/18"
"956",956,956,"Evan Kolodzinski",0,"And we didn't SHIT BOUT it","4/3/18"
"957",957,957,"toast gamer_ YT",0,"It's the the gun that kills people it's the people behind the gun that make that stupid choice","4/3/18"
"958",958,958,"Richard Mormon",0,"Makes no sense you have to be 21 to buy a handgun? A handgun can be easily hidden unlike an AR-15","4/3/18"
"959",959,959,"Anime GirlTaraji",0,"This is so so sad. But it was there time to go to live with God in the holy heaven. Like if you pray for them","4/3/18"
"960",960,960,"Vinyl Scratch HBC",0,"White boy at it again _ÌâåªÌâåÉÌâå¥","4/3/18"
"961",961,961,"Intimate Taurian",0,"Why are people blaming the gun and NRA for these mass shootings? Does it make sense that guns donÌâå_ÌâåÑÌÄåöt control people? Or the NRA Ìâå_ÌâåÑÌâåÒDIDÌâå_ÌâåÑÌâå not plan these shootings? ItÌâå_ÌâåÑÌÄåös like blaming the bomb exploding and killing hundreds of people and not the suicide bomber who decided to set it off. Understand the logic. ItÌâå_ÌâåÑÌÄåös not rocket science itÌâå_ÌâåÑÌÄåös common knowledge.","4/3/18"
"962",962,962,"Bri Vlogs",0,"WhatÌâå_ÌâåÑÌÄåös the logic of sending 18 year old kids to war ? ThatÌâå_ÌâåÑÌÄåös ok , but they canÌâå_ÌâåÑÌÄåöt buy a semiautomatic rifle ? All these same kids that are out to get the weapons like lemon ! Saw all this shit on his media page never called anyone!","4/3/18"
"963",963,963,"Lexie's Fun corner!",0,"Why kill these poor teens they just wanna live life peacefully","4/3/18"
"964",964,964,"Larry Williams",0,"That's not even a real gun that's a cybergun/kwc 1911 tactics 6mm airsoft gun that shoots plastic bbs it even has the orange tip and cnn painted it black for the pic","4/3/18"
"965",965,965,"Billy Holmes",0,"more babies are murdered in the us than all of the gun involved deaths and automobile deaths per year if people  cared they would stop abortion babies have no say in what happens just scrambled up like eggs then vacuumed out by deranged doctors because people think abortions are easier than using  a condom or taking the pill dont say you care about children's lives yet condone abortion. shame shame shame no wonder young people have no respect for life when taught in school that killing babies are ok some states dont even need to have parents informed there daughter is a sperm bank killing babies ... i never have seen a gun behind bars i never herd a gun  say im going out to kill people today just like drunk drivers dont go out to kill people but they do yet no one is trying to ban cars to make people safe.  no cars means no drunk drivers means no road deaths or life long injuries and cars kill more Americans a year than guns do.. hay Hollywood were is march against cars ???so keep your hands off my guns and ill keep my guns out of your face","4/3/18"
"966",966,966,"Elizabeth Weine",0,"USA Should put the LAW to have a lison for GUNS! (Sorry for my bad spelling)","4/3/18"
"967",967,967,"Mystreet FanGirl",0,"Atleast were safe in the comment section and rest in peace _ÌâåªÌâåÉÌâå¢_ÌâåªÌâåÉ__ÌâåªÌâåÉ__ÌâåªÌâåÉ__ÌâåªÌâåÉ__ÌâåªÌâåÉ_","4/3/18"
"968",968,968,"Jay P",0,"Ìâå_ÌâåÑÌâåÒWhy is it that no one went to police to report this?Ìâå_ÌâåÑÌâå The students did report it time and time again! ItÌâå_ÌâåÑÌÄåös the adults fault for not being able to prevent this tragedy that should not have taken place. They need to pay more attention, to listen more. You need to be 21+ to have drink, but you can buy a gun at 18? We need gun laws. I think all the problems we have with shootings are our fault. We keep crying out but are unwilling to do anything.","4/3/18"
"969",969,969,"Brandon Hayes",0,"Katie x look love. Sometimes the truth hides in plain sight. Dig deeper is all I'm saying beloved. I mean no harm. Open your mind. Research false flags history. Like Sandy Hook and then come back and respond to me. Look up Robbie Parker. Crisis actors. Gene Rosen....The timeline doesn't add up. The abolishing of the 2nd Amendment. Gun Control. I'm not saying this is always the case, but just look a little deeper. Research the illuminati and the Free Masons. Skull and bones. Bohemian Grove and our politicians having Satanic Rituals there aka making policies there on how to police America, keeping the vast majority of the public lost and easily fooled. They have the tools to so so, and have had it for so long. Seek TRUTH, even if it seems unreal. Usually love, it's stranger than fiction. This case is very strange. Hope this helps. The storyline here is similar to other ones that made it to national television.","4/15/18"
"970",970,970,"Katie x",0,"Brandon Hayes Well you canÌâå_ÌâåÑÌÄåöt seem to say much can you? Ìâå_ÌâåÑÌâåÒLol.Ìâå_ÌâåÑÌâå","4/15/18"
"971",971,971,"Brandon Hayes",0,"Katie x whatever you say.lol","4/15/18"
"972",972,972,"Katie x",0,"Brandon Hayes You conspiracy theorists are sometimes sick.","4/12/18"
"973",973,973,"john alt",0,"Katie x it's really not the unusual for a 17 year old thinking about hunting, I had friends that were hunting by 12, they never killed people. If you look at the tweets none of the conversations were creepy, I'm just saying alot of kids even young adults would have similar tweets or posts and it would be rare that one would shoot up a school. There are no threats in any of these posts, I don't see the red flag.","4/12/18"
"974",974,974,"Katie x",0,"john alt Seriously? The hunting thing shouldÌâå_ÌâåÑÌÄåöve been a red flag! HeÌâå_ÌâåÑÌÄåös a KID! And wants a gun? None of that raised a bit of concern?
Never mind, he is an American. What did I expect?","4/12/18"
"975",975,975,"zero g templar",0,"Dolen Kirstein, Gun control does not = crazy control. you could be killed with a knife or a bomb,  a person intent on killing is not going to distress themselfs over the method they use. china has had numbers mass knife killings  https://www.cnn.com/2014/03/01/world/asia/china-railway-attack/index.html
look it up a Knife wielding attacker killed 29 and injured 130..... 
Hitler also wanted gun control and look where that took Germany! Gun control= human control you may want to subjugate your self to the state and have them dictate to you what freedoms you are entitled to but I do not wish that!","4/5/18"
"976",976,976,"Reece Shipley",0,"try and take my guns away u can't change my rights bitch","4/4/18"
"977",977,977,"mona lisa",2,"what if a teacher turns on students?","4/9/18"
"978",978,978,"M3MPHI5",0,"also as the cookie crumbles..hoggwash wasnt evem at school..and moet the activist are known bullies to the shooter...irony? or poetic justice?","4/3/18"
"979",979,979,"Bjswac",0,"When did journalisg began having an opinion on the news and getting frustrated when they are briefed about the situation? These people, like Don Lemon, have zero professionalism.","4/3/18"
"980",980,980,"Perry Chevalier",0,"The reason why you have to be 21 to buy a handgun is because there are more shootings that ocher with handguns Than rifles","4/3/18"
"981",981,981,"Justin Yang",0,"your ass is getting fucked in prison white boi.","4/3/18"
"982",982,982,"JasonTheSilent",0,"Well I mean a handgun can easily be concealed unlike a rifle and there also is no such thing as an Ìâå_ÌâåÑÌâåÒassault rifleÌâå_ÌâåÑÌâå","4/2/18"
"983",983,983,"Ric Saxton",0,"It's a Airlsoft pistol you fucking morons! A 16 yr. Old kid can purchase as many as he/she desires.Disturbing images of Airsoft guns and pocket knives that you can buy at any carnival. I call psy-opp bullshit!","4/2/18"
"984",984,984,"Jesse Davis",0,"good thing he wasn't black .. police would of shot him to pieces","4/2/18"
"985",985,985,"Abilene Ramirez",0,"Find the differens

_ÌâåªÌâåÉÌâå_ÌâåªÌâåÉÌâå_ÌâåªÌâåÉÌâå_ÌâåªÌâåÉÌâå_ÌâåªÌâåÉÌâå_ÌâåªÌâåÉÌâå_ÌâåªÌâåÉÌâå_ÌâåªÌâåÉÌâå_ÌâåªÌâåÉÌâå_ÌâåªÌâåÉÌâå_ÌâåªÌâåÉÌâå_ÌâåªÌâåÉÌâå_ÌâåªÌâåÉÌâå_ÌâåªÌâåÉÌâå_ÌâåªÌâåÉÌâå_ÌâåªÌâåÉÌâå_ÌâåªÌâåÉÌâå_ÌâåªÌâåÉÌâå_ÌâåªÌâåÉÌâå_ÌâåªÌâåÉÌâå_ÌâåªÌâåÉÌâå_ÌâåªÌâåÉÌâå_ÌâåªÌâåÉÌâå_ÌâåªÌâåÉÌâåÑ_ÌâåªÌâåÉÌâå_ÌâåªÌâåÉÌâå_ÌâåªÌâåÉÌâå_ÌâåªÌâåÉÌâå_ÌâåªÌâåÉÌâå_ÌâåªÌâåÉÌâå_ÌâåªÌâåÉÌâå_ÌâåªÌâåÉÌâå_ÌâåªÌâåÉÌâå_ÌâåªÌâåÉÌâå_ÌâåªÌâåÉÌâå_ÌâåªÌâåÉÌâå_ÌâåªÌâåÉÌâå_ÌâåªÌâåÉÌâå_ÌâåªÌâåÉÌâå_ÌâåªÌâåÉÌâå_ÌâåªÌâåÉÌâå_ÌâåªÌâåÉÌâå_ÌâåªÌâåÉÌâå_ÌâåªÌâåÉÌâå_ÌâåªÌâåÉÌâå_ÌâåªÌâåÉÌâå_ÌâåªÌâåÉÌâå_ÌâåªÌâåÉÌâå_ÌâåªÌâåÉÌâå_ÌâåªÌâåÉÌâå





If u find it u are a kind person       

If u don't find it u are troublemaker","4/2/18"
"986",986,986,"Tyler Garrison",0,"i believe that all guns should be illegal to purchase until you are 25 but the reason you can not get a hand gun until you are older is because a handgun is small and can easily be concealed","4/2/18"
"987",987,987,"allysa williams",0,"These dumbasses.... you have to be 21 to get a handgun OR rifle. Fucking dumb fucks. That's how it is where I am","4/2/18"
"988",988,988,"Jacob Risner",0,"He was reported to the FBI 5 months prior to the shooting for posting online he was going to be a professional school shooter. Handguns are more easily concealed, that's the logic.","4/2/18"
"989",989,989,"Phillip Beckman",0,"Federal laws are crooked","4/2/18"
"990",990,990,"official BYE HATERS",0,"I'm so late.. Well I just noticed that on the news long time ago OHHHH DID U GUYS KNEW THAT THERE was a circus right in front of where I live I didn't get to go but the circus was called Volta and this man died..  I feel so bad for him and he's family but uhhh he fell and he died and he haded 2 children and a wife.. O.o that's why I don't go to circus I don't trust CLOWNS..  Only one type of clowns that I saw _ÌâåªÌâåÉÌÄå_ I went to the fair it was hilarious..  But anyways I don't trust other clowns with chain saws and other weapons..  I guess that nvm I better never give that idea out cause who knows when they're going to dress up into everything oh and guess what I went to a hunted house and the man that used to kill alot that didn't get cought and finally he got caught on Christmas month?  IDK and we went to a hunted house and we were going on the first one and this dude was running and the cops were after him and that wasn't even supposed to have cops chasing a person..  So the place was closed for like 5 minutes it was scary as heck really but It was fun :) SADLY I had my make up on as a skeleton but uh they dont let face paint on..  Cause of the dangers and usually it was hilarious OK enough typing about me IM DONE TYPING bye!  I hope u enjoy this annoying a*$ story about a little bit of what happend. In my past, :)","4/2/18"
"991",991,991,"official BYE HATERS",0,"Um I afraid this kid is gonna be uh a dangerous person on insta like he followed me I followed him back even if I don't know him he's a kid and he seems 13 or 14 or maybe  15 he like post guns and all that and I said to my self if he continues to post more guns then I'm going to say hey u better stop posting that before 1 I go to the cops and 2 ILL UNFOLLOW U!","4/2/18"
"992",992,992,"official BYE HATERS",0,"Yeah yeH ENOUGH TALKING!  I want to see who tf did this becuse we HAD A LOCK DOWN FOR NO F REASON AND it didn't go well because this girl was like wahhhhh the other girl was snoring and I was like here OMFG if this was real we would've been the first people to die -_-","4/2/18"
"993",993,993,"MusicTube",0,"Yes it makes sense, do people pull AR-15 out of their pants. Because of retarded mental kids, all people will be considered school shooters for owning a gun.","4/2/18"
"994",994,994,"Syd Adnan",0,"Execute the murdering son of a bitch Nikolas Cruz","4/2/18"
"995",995,995,"B. G. Lobb",0,"Well, I'm no expert, but that law does make sense. Handguns are much more dangerous, as they can be concieled.","4/2/18"
"996",996,996,"Deer Hunter 4 life",0,"I hope this never happens again but he passed all fucking background checks legally how about we get better background checks and not take away the rights of some law abiding citizens","4/2/18"
"997",997,997,"michael oconnor",1,"I know these people are clearly upset and for good reason but they aren't thinking logically and blaming the guns when they're not the problem. Someone could do nearly the same thing with a kitchen knife or even more damage with a car or van so should we ban those. No. I think banning guns isn't going to work but i think mental health evaluations before buying a gun of any kind. 1 other thing I think is wrong with this video is they're saying that anyone who posts pictures or videos of guns should be reported. I'm BY NO MEANS saying that if someone's making threats (that's when you should report them) not to report them but that just because someone has an interest in guns or knifes and wants to share they're interest's with other people DOES NOT mean they're going to shoot up the local school, it just means they're expressing theyre interests. I'm neutral in this debate as I'm from Ireland and guns aren't a huge thing here(unfortunately) and neither of my parents own guns and I've never held a real one other than when i went on a visit to the army barracks with scouts a couple of years ago but i intended to get 1 when I'm 16. Btw I'm 14 an i have more sense than most of the liberals in your country as i wont blame an inanimate object for things that happen. You don't blame misspelled words on your pencil, so why blame a gun for someone's actions.","4/1/18"
"998",998,998,"Sketti Neal",0,"WRONG!!!!! Please educate yourself on guns, and do not listen to others.","4/1/18"
"999",999,999,"Adam Loc",0,"More CNN lies, and propaganda perpetrated by the government police state.","4/1/18"
"1000",1000,1000,"Adam Loc",0,"Notice how they say killing law enforcement, but nothing about the MAGA hat he was wearing when shooting his BB GUN.","4/1/18"
"1001",1001,1001,"Jodi Reese",0,"Lmao lemon is a fckin pussy hahahaha","4/1/18"
"1002",1002,1002,"james bond007",0,"When they found this kid, he was out cold. Anyone see that.? You know, like Timothy  McViegh of Oklahoma city bombing. They found him staggering up the road like he had been drugged too, these posts don't look bad to me, maybe I missed something. Of course ole Lemmon head is deep state operative so he would only show us the worst things.. You know, to suit the narrative of these anti 2nd amendment scum politicians and FEDS created this event for..","4/1/18"
"1003",1003,1003,"Chris Co. Industries",0,"If the news reporter viewed his social media page THEN why didnÌâå_ÌâåÑÌÄåöt he say something","4/1/18"
"1004",1004,1004,"Cally Lawrence",0,"EWWWWWWWW","4/1/18"
"1005",1005,1005,"Sinner 4EVER",0,"toy gun, look at red tip","4/1/18"
"1006",1006,1006,"jj hart",0,"U can conceal a handgun. That's why u can't legally own one until ur 21. But an assault rifle can be purchased at 18 because it's more easily detected than a handgun and rifles are commonly used for hunting.","4/1/18"
"1007",1007,1007,"Monica Daproza",0,"Tsk Tsk. Indifference is really more dangerous than anger. 
My condolences to all the families affected","4/1/18"
"1008",1008,1008,"Paul Smith",0,"False flag","4/1/18"
"1009",1009,1009,"iiEmmeisbest",0,"Hopes and prayers _ÌâåªÌÄåöÌâå","4/1/18"
"1010",1010,1010,"Kyle O'Donnell",0,"Ìâå_ÌâåÑÌâåÒAssaultÌâå_ÌâåÑÌâå style rifled. This is truly a comical phrase I constantly keep hearing. He states, he does not have much knowledge on firearms, (clearly) however, possess common sense but canÌâå_ÌâåÑÌÄåöt comprehend the logic behind the legal age to buy a rifle and a handgun. Maybe you should start off by acquiring the brain capacity to understand the definition of assault, then learn how to use the word properly and stop misguiding people. ItÌâå_ÌâåÑÌÄåös a truly despicable display of humanity when everyone is so admit about blaming and pointing fingers on why this happened as if itÌâå_ÌâåÑÌÄåös not the shooters fault? These disgusting creatures that call themselves humans are mocking in the faces of the families who lost their loved ones by using them in vain. Pushing agendas buy promoting dead children? Does anyone look themselves in the mirror and understand how they sound? What is wrong with this country?","4/1/18"
"1011",1011,1011,"shaquille villaruel",0,"Wow.... Trump say he would make america great and save.... Idiot... My condolence goes out to the family that lost there love one in this tragic incident...","4/1/18"
"1012",1012,1012,"Martin Garcia",0,"Yes. 21 to get a handgun. 98% of the shootings happen with handguns. 2% with assault rifles. Dumbfucks.","4/1/18"
"1013",1013,1013,"Hunsberger Whitetails 02",0,"3:11 oh no he has a toy gun with an orange tip. ThatÌâå_ÌâåÑÌÄåös really disturbing right. And they should know itÌâå_ÌâåÑÌÄåös fake anyways cuz they just got done saying he has to be 21 yo buy a handgun","4/1/18"
"1014",1014,1014,"Tanner Cole",0,"Idiots","4/1/18"
"1015",1015,1015,"Cempa TV",0,"Yall americans have holes in laws and police are dumb aff","4/1/18"
"1016",1016,1016,"Spartan Boi",0,"1:25 the guy on the left is me right now!!!!!!!!!!!!!!!!!!!!!! I like guns and all that, but this is complete BULLSHIT!!!!!!!!!","4/1/18"
"1017",1017,1017,"H1TM5N GAMING",0,"Cristians terrorist","4/1/18"
"1018",1018,1018,"J R",0,"i hear alot of americans saying that stricter gun laws would not help at all because its all about mentally ill people killing others. does that mean america is full of mentally ill people haha","4/6/18"
"1019",1019,1019,"Chris Tracks",0,"Vunqs bitchhhh_ÌâåªÌâåÉÌÄå_","4/14/18"
"1020",1020,1020,"FemaleIntrovert",0,"Vunqs you sure fooled me _ÌâåªÌâåÉÌâåÐ","4/1/18"
"1021",1021,1021,"Darryl gaming",0,"Bruze Melange shut up that's why you have no subs","4/21/18"
"1022",1022,1022,"Bruze Melange",0,"darril gaming, Sounds like your weed was sprayed with ""dumb ass"".","4/11/18"
"1023",1023,1023,"Reggin Lover",0,"They are BLAMING WHITE MEN! These school shooters are ALL spics pretending to be white, so they can ruin the image of white males!!!","4/22/18"
"1024",1024,1024,"WiseSageBum",0,"I'm sure that the gun helps though, I mean, it's a lot harder to kill people by going up to them and shouting ""BANG!""","4/17/18"
"1025",1025,1025,"Tank_Frenzee",0,"Sst Pilot RIGHT YO THESE LIBTARDS ARE RETARTED","4/13/18"
"1026",1026,1026,"this is brak's pu don't touch it",0,"Are government can put people on a don't fly list but they can't put them on a don't buy list there's something wrong when you can't get a plain ticket but you can go and buy any gun.","4/6/18"
"1027",1027,1027,"Date Masamune",0,"Crazy people shouldn't own guns. Most of America is crazy. Therefore, most of America shouldn't own guns.","4/4/18"
"1028",1028,1028,"Tara Tucker",1,"Jeffrey Sophan The best fn comment on here!!! Thank you!!_Ìâåª_ÌâåÉ_ÌâåªÌâå¥Ìâå_ÌâåªÌâå¥Ìâå_ÌâåªÌâå¥Ìâå_ÌâåªÌâå¥Ìâå_ÌâåªÌâå¥Ìâå","4/22/18"
"1029",1029,1029,"Christopher Botcheos",0,"People WITH guns kill people","4/21/18"
"1030",1030,1030,"Pio Sanchez",0,"Lordchicken Yo Momma Should Slap You!!! Is Meth,Heroin, Cocaine Sold In Stores??","4/20/18"
"1031",1031,1031,"superman lover",0,"You dumb fuck.","4/14/18"
"1032",1032,1032,"Lordchicken",0,"Jeffrey Sophan guns are used to kill people you fucking retard and there would be less chance of these 17 people being killed if there was no guns","4/13/18"
"1033",1033,1033,"jeniffer pimentel",0,"it rest and peace","4/21/18"
"1034",1034,1034,"Caroline Bennett",0,"Lol","4/21/18"
"1035",1035,1035,"Gabriel Nieves",0,"FireworkWolf Are u sure about that?","4/22/18"
"1036",1036,1036,"Gorilla DETROIT",0,"1999sonicboom hahah","4/12/18"
"1037",1037,1037,"YoloRam",1,"Shxft You just made it worse","4/10/18"
"1038",1038,1038,"FireworkWolf",2,"Shxft 
It wouldn't be funny if anyone died","4/9/18"
"1039",1039,1039,"Shxft",0,"1999sonicboom not funny this is serious it will be funny if you died","4/4/18"
"1040",1040,1040,"THE SKG",0,"You want me to shoot up canada?","4/22/18"
"1041",1041,1041,"LadyDayDream",0,"America has the sickest society! there have already been at least 17 school shootings so far in 2018. And they're trying to fix other country's problem. LOL. Their own society is the only problem that they have to fix. Sorry not to sorry.","4/20/18"
"1042",1042,1042,"fun with kitty gaming",0,"Me too","4/18/18"
"1043",1043,1043,"coc gameplay",0,"1999sonicboom everywhere but america sucks dick","4/16/18"
"1044",1044,1044,"coc gameplay",0,"bob tim yeah free health care they take half ur check dumbass_ÌâåªÌâåÉÌÄå__ÌâåªÌâåÉÌÄå_","4/16/18"
"1045",1045,1045,"Heaven Smith",1,"J R God does Bless you even in the Smallest u biggest ways. Ima pray for you that u believe in him.Jesus is coming soon,and when he does Your gonna be repenting and saying sorry that you didn't believe in him. But hey I'm not tryna make you feel bad.If I am then I'm sorry. And I dont hate you or nothing. I have alot of atheist friends. Your choice is your choice. God Bless you_ÌâåªÌâå¥__ÌâåªÌâå¥__ÌâåªÌâå¥__ÌâåªÌâå¥_","4/6/18"
"1046",1046,1046,"J R",0,"god does not bless me nor do i care","4/6/18"
"1047",1047,1047,"Heaven Smith",1,"J R Im honestly not answering that reply becuz u just dont understand wut I'm saying either that or ur just trying to twist my words. But....... God Bless u. N ur in my prayers__ÌâåªÌÄåöÌâå_ÌâåªÌÄåöÌâå_ÌâåªÌÄåöÌâå_ÌâåªÌâå¥__ÌâåªÌâå¥__ÌâåªÌâå¥_","4/6/18"
"1048",1048,1048,"J R",0,"so being a christian means you cant be a shooter ? haha","4/6/18"
"1049",1049,1049,"gabrielwhite",0,"yea and with a knife you can kill 17 people around you right? If someone comes against me with a knife i can run away. Try to run a way from an assault rifle. Your statement is so pointles","4/22/18"
"1050",1050,1050,"Gorilla DETROIT",0,"Slammed Sedan Damn true asf","4/12/18"
"1051",1051,1051,"Chris Tracks",0,"Yuck Fou _ÌâåªÌâåÉÌÄå__ÌâåªÌâåÉÌÄå__ÌâåªÌâåÉÌÄå_","4/14/18"
"1052",1052,1052,"Damien K.",0,"Yuck Fou LOLLLLLLL","4/5/18"
"1053",1053,1053,"zipper eggnog",0,"fucking liberal","4/17/18"
"1054",1054,1054,"dono Taylor",0,"god don't give a fuck about these dirt napers! your stupid ass prayers ain't going to work","4/19/18"
"1055",1055,1055,"Bruze Melange",1,"jeriah, Are you well? You sound ill. Odd for a bot.","4/11/18"
"1056",1056,1056,"dono Taylor",0,"fuck your prayers. you moron!","4/19/18"
"1057",1057,1057,"Aaron Krebs",0,"Oh Trump's responsible for every shooting all democrat's say.. lol","4/22/18"
"1058",1058,1058,"M J",0,"Jak Gaming Trump is the reason for all this hate","4/22/18"
"1059",1059,1059,"Reggin Lover",0,"Because this wannabe white DIRTY SPIC wants to shoot up a school??? THIS IS NOT A WHITE PROBLEM, this is a HISPANIC!!! There is an agenda to demonize white males, using inbred spics as martyrs!","4/22/18"
"1060",1060,1060,"Aaron Krebs",1,"This is the cops job, quit whining about our president he had nothing to do with this your braindead sheep","4/13/18"
"1061",1061,1061,"Gabe Nguch v2",0,"What do u want him to do","4/12/18"
"1062",1062,1062,"Bruze Melange",0,"sander nielsen, I'll take living in this ""wrong"" country any day. Europe is full of helpless sheep getting rolled over by the muslim immigrant  flood. Good luck and help stop the rape of your women by the  mus-a-lum virus.","4/11/18"
"1063",1063,1063,"Ìâå_ÌâåÑÌâå_ANGÌâåÕ_|Ìâå_ÌâåÑÌâå_",0,"Chelsey'sClarity ahh just read, nah it doesnÌâå_ÌâåÑÌÄåöt matter lmao I was goofing off/bunch of bs no need to waste time, letÌâå_ÌâåÑÌÄåös look and move on.","4/22/18"
"1064",1064,1064,"Ìâå_ÌâåÑÌâå_ANGÌâåÕ_|Ìâå_ÌâåÑÌâå_",0,"Reggin Lover hide your kids, hide your wife and hide you ugly cousin cause their raping everybody out hereÌâå_ÌâåÑÌâå hahaha IÌâå_ÌâåÑÌÄåöll get better dude trust me someday you wonÌâå_ÌâåÑÌÄåöt have to worry","4/22/18"
"1065",1065,1065,"Ìâå_ÌâåÑÌâå_ANGÌâåÕ_|Ìâå_ÌâåÑÌâå_",0,"Chelsey'sClarity not sure man hahaha I forgot about this, what ever it was, maybe, anyways IÌâå_ÌâåÑÌÄåöm watching this video on leprechaun in the hood news you should check it out","4/22/18"
