"","X.1","X","all_comments.authorDisplayName","all_comments.likeCount","all_comments.textOriginal","all_comments.publishedAt"
"1344",1344,1344,"Shaykh Yerbouti",0,"*Metal detectors are proven* to get even crazy people (drunk on Allah) to stop shooting up Jew kids/Jew schools.  *Banning guns is proven to... get cartels -- or despots -- having a MONOPOLY on firepower,* which they abuse.  *""Power corrupts,"" and a MONOPOLY on economic power, MONOPOLY on firepower, or MONOPOLY on media power, etc, is what ""corrupts absolutely"" as the saying goes.  The Zetas cartel are the **google.com/search?q=NOMENKATURA** cronyinsts of PRI* (socialist party of MEX), journalist Carmen Arristegui proved -- *including the president (Senor Socialist Pena Nieto) paid to ""look the other way"" as kidnappings (usually with RAPE until the father pays)/sex-slavery (combined) for a MEX woman today = 15% before she hits age 65.  15% of all women.*  Men are harder to kidnap, so it's more rare unless you're part of an enemy cartel, but then torture-instead-of-rape is typical.

+Jorge MOST cartel guns are traced to the insanely high 1-in-8 soldiers in MEX'S OWN ARMY who go AWOL -- with their rifle.  And CORRUPT OBAMA DIRECTLY ARMED cartels with a few thousand more.

Even more are 3D PRINTED AR15's (see my last paragraph for what happens if USA bans AR15's, and how HILARIOUSLY naive you must be if you think that will empower anyone EXCEPT criminals who'll make home-made AR15's EASILY w/today's technology).

Anti-gun Broward County Sheriff says ""only police professionals should have guns"" as 4 of his deputies fail to protect students with their guns.  Despite they already had bodyarmor.  MEX poice are even worse (even of those not CORRUPT, the rest are mostly coward, and DON'T mostly have bodyarmor to increase their bravery, nor guns as powwerful as the cartel sicarios').

...and Gun-free zones?  Don't even make me laugh; *98% of mass-shootings happened in the Democrat-created gun-free zones.*  This is a ""Shooting fish in a barrel zone, until typical police response-time of 5-12 minutes, or worse the police wait for SWAT which is a typical >25 minute response-time"" which encourages the mass-shooters.  *So a gun-free zone is just a smaller and shorter-term version of despots or cartels having a MONOPOLY on firepower;* good going ""brilliant"" Socialist-Democrat legislators.  Most of these shooters are crazies who commit suicide before the police even arrive, or commit ""suicide by cop"".  WHEN YOU HAVE SECONDS TO LIVE, HELP (POLICE) ARE ONLY MINUTES AWAY. :-)

. . . The millions killed by those Mexican cartels or (usually SOCIALIST) despots facing Disarmeed Sheeple makes ALL school shootings since 1990 look TAME in comparison; even CHICAGO'S ONE YEAR DEATH-COUNT of 2015 or 2016 or 2017 makes ALL school-shootings look TAME in comparison -- but of course the media ignores Chicago, they don't ACTUALLY care about Black people any more than GW Bush did.  ...and so you're left with irrational people who think Western society's biggest problem is mass shootings; the media makes you think cops shot mostly Blac people also, when the REALITY is that, per arrest, the suspects who are white get killed by the cops the MOST often.  MEDIA's coverage is not in-line with the real prevalence of murder-rates; same with the prevalence of whom cops ACTUALLY shoot-during-arrests.  You'd think the media maybe WANTS Blacks to riot, assassinate police, starting a race-war they are ill-prepared to win?

*EVERY mass-shooter was stopped when force was met with force.  So you need hard targets,* not ""shooting fish in a barrel until police arrive"" soft targets, nor ""ban guns and WAIT MINUTES for police"" when shootings can happen in SECONDS 
. . . Also, *_ANYONE CAN 3D PRINT AN AR15 OR GLOCK from plastic and billet aluminum for a <$1,000 machinee that builds >10 FULL-auto rifles per day, you DOPEY Democrats, then the cartel has employees cut the barrels and MANUFACTURE their own ammo -- which any APPRENTICE BLUE FUCKING COLLAR machinist can do.  Idiots. (you are therefore only going to disarm the honest, hard-working portion of society, so ORGANIZED CRIME can prey upon them)_*  Israelis also did home-made guns and beat FIVE Arab armies with these, when in 1938-1947, UK saw that Hitler was the next man they'd need to fight and wanted to woo the already-HITLER-ALLIED Palestinians (didn't work) by alienating their ties to the Jews and Jordanians, a cassified internal memo released near Y2K says that was their motive.

A SEMI OR FULL AUTO RIFLE aint rocket science; banning them = you unilaterally disarm yourselves, whilst people WHO WANT TO KILL YOU cannot be disarmed -- even if you ban 3D printers.","4/3/18"
"1345",1345,1345,"Shaykh Yerbouti",0,"+Michael LeBlanc  WRONG.  It's like you've never been to Mexico, because there's NOT an ""outright ban"" -- only ""limited"" access for those who carry guns LEGALLY... and that was still enough that the CARTELS ARE WINNING.  That's WHY _U.S. v Miller_ says every citizen needs access to firearms EQUAL TO what an Army PFC in the infantry would carry.","4/2/18"
"1346",1346,1346,"B D",0,"L haiar... yeah know the uk is calling for knife control you cant carry knifes lmao priceless!!! i bet you would agree with that too lmao!!!  Yeah cause the crimnals put down the drugs from them being banned over your head part 1..... you dont have to store your ammo and weapons in diff places obviously you havnt visited where i live over your head part 2.... and lastly over your head my shit is locked and loaded i dont have to load it i can grab point n shoot and even if not i could load 5 guns and empty them under 2-5 police just be clean up at that point!!!!","4/15/18"
"1347",1347,1347,"B D",0,"Michael adkins>>Give me the difference between a rifle and a assault rifle???","4/15/18"
"1348",1348,1348,"B D",0,"Traci sims-A grenade launcher would indeed make them deader lol all over the place! As far as parkland he could have used a variety of weapons that would have done the same thing as the AR-15 that dont look like it at all! yall wanna ban something you have no clue about the fact that hand gund are used more in schools then a rifle cause its easier to hide but the rifle is the number 1!  And beacuse when you ban 1 they will eventually get the others and then you're screwed! And why cant we blame the kid who did it i mean if only he didnt have that gun............... well he would have found another way why not ban crazy people oh thats right they do but the cops there decided to say screw it we will keep letting him silde hes not gonna shoot up the school like he says he is!!  40 times is plenty dont you think to put someone in jail for shit i would think! but silly conservative me i live in a world where bad shit happens and you cant do shit about it but try and protect yourself if something does happen.","4/15/18"
"1349",1349,1349,"B D",0,"Why not a bb gun then since im sure they are nice crimals!!! why not just tel make they self at home holler if you need anything lol!! This is why we talk about this to people like you! you can not own a atuomatic weapon just about every hand gun rife shotgun are semi-auto NOT fully auto you jake asses are agruing for shit you know nothign about! but for a giggle look fully auto, semi-atuo, and since you dont like the scary black AR-15 look up a mini-14 same ammo shoots just as fast but isnt the scary black one lol!! if you wann ban something atleat know what your banning first!","4/15/18"
"1350",1350,1350,"B D",0,"doesnt make you a gun expert tho?? just sayin!!!

iv drove a car over 100 before doesnt mean nascar is gonna be calling soon to drive they'res!!!","4/15/18"
"1351",1351,1351,"Shaykh Yerbouti",0,"SOLUTIONS: *Metal detectors are proven* to get even crazy people (drunk on Allah) to stop shooting up Jew kids/Jew schools.  *Banning guns is proven to... get cartels -- or despots -- having a MONOPOLY on firepower,* which they abuse.  *""Power corrupts,"" and a MONOPOLY on economic power, MONOPOLY on firepower, or MONOPOLY on media power, etc, is what ""corrupts absolutely"" as the saying goes.  The Zetas cartel are the **google.com/search?q=NOMENKATURA** cronyinsts of PRI* (socialist party of MEX), journalist Carmen Arristegui proved -- *including the president (Senor Socialist Pena Nieto) paid to ""look the other way"" as kidnappings (usually with RAPE until the father pays)/sex-slavery (combined) for a MEX woman today = 15% before she hits age 65.  15% of all women.*  Men are harder to kidnap, so it's more rare unless you're part of an enemy cartel, but then torture-instead-of-rape is typical.

Also, *MOST cartel guns are traced to the insanely high 1-in-8 soldiers in MEX'S OWN ARMY who go AWOL -- with their rifle.*  And CORRUPT OBAMA DIRECTLY ARMED cartels with a few thousand more.  So again, the Dem Party ""solution"" is to arm criminas, and disarm the honest, hard-working people.

Even more are 3D PRINTED AR15's in some cartes (see my last paragraph for what happens if USA bans AR15's, and how HILARIOUSLY naive you must be if you think that will empower anyone EXCEPT criminals who'll make home-made AR15's EASILY w/today's technology).

...and Gun-free zones?  Don't even make me laugh; *98% of mass-shootings happened in the Democrat-created gun-free zones.*  This is a ""Shooting fish in a barrel zone, until typical police response-time of 5-12 minutes, or worse the police wait for SWAT which is a typical >25 minute response-time"" which encourages the mass-shooters.  *So a gun-free zone is just a smaller and shorter-term version of despots or cartels having a MONOPOLY on firepower;* good going ""brilliant"" Socialist-Democrat legislators.  Most of these shooters are crazies who commit suicide before the police even arrive, or commit ""suicide by cop"".  WHEN YOU HAVE SECONDS TO LIVE, HELP (POLICE) ARE ONLY MINUTES AWAY. :-)

Anti-gun Broward County Sheriff says ""only police professionals should have guns"" as 4 of his deputies fail to protect students with their guns.  Despite they already had bodyarmor.  MEX poice are even worse (even of those not CORRUPT, the rest are mostly coward, and DON'T mostly have bodyarmor to increase their bravery, nor guns as powwerful as the cartel sicarios').

. . . The millions killed by those Mexican cartels or (usually SOCIALIST) despots facing Disarmeed Sheeple makes ALL school shootings since 1990 look TAME in comparison; even CHICAGO'S ONE YEAR DEATH-COUNT of 2015 or 2016 or 2017 makes ALL school-shootings look TAME in comparison -- but of course the media ignores Chicago, they don't ACTUALLY care about Black people any more than GW Bush did.  ...and so you're left with irrational people who think Western society's biggest problem is mass shootings; the media makes you think cops shot mostly Blac people also, when the REALITY is that, per arrest, the suspects who are white get killed by the cops the MOST often.  MEDIA's coverage is not in-line with the real prevalence of murder-rates; same with the prevalence of whom cops ACTUALLY shoot-during-arrests.  You'd think the media maybe WANTS Blacks to riot, assassinate police, starting a race-war they are ill-prepared to win?

*EVERY mass-shooter was stopped when force was met with force.  So you need hard targets,* not ""shooting fish in a barrel until police arrive"" soft targets, nor ""ban guns and WAIT MINUTES for police"" when shootings can happen in SECONDS 
. . . Also, *_ANYONE CAN 3D PRINT AN AR15 OR GLOCK from plastic and billet aluminum for a <$1,000 machinee that builds >10 FULL-auto rifles per day, you DOPEY Democrats, then the cartel has employees cut the barrels and MANUFACTURE their own ammo -- which any APPRENTICE BLUE FUCKING COLLAR machinist can do.  Idiots. (you are therefore only going to disarm the honest, hard-working portion of society, so ORGANIZED CRIME can prey upon them)_*  Israelis also did home-made guns and beat FIVE Arab armies with these, when in 1938-1947, UK saw that Hitler was the next man they'd need to fight and wanted to woo the already-HITLER-ALLIED Palestinians (didn't work) by alienating their ties to the Jews and Jordanians, a cassified internal memo released near Y2K says that was their motive.

A SEMI OR FULL AUTO RIFLE aint rocket science; banning them = you unilaterally disarm yourselves, whilst people WHO WANT TO KILL YOU cannot be disarmed -- even if you ban 3D printers.","4/3/18"
"1352",1352,1352,"Diana Zarudnaya",0,"_ÌâåªÌÄåãÌÄåÊ_ÌâåªÌÄåã__ÌâåªÌÄå_ÌÄåÝ *_Ìâå¢ok_Ìâåµns* Ìâå___ [ pidtu.au-on.ru ] Ìâå_ÌÄå£ÌÄåÏ *_Ìâå¢__k_Ìâåµns* _ÌâåªÌÄåãÌÄåÊ_ÌâåªÌÄåã__ÌâåªÌÄå_ÌÄåÝ
_ÌâåªÌÄåãÌÄåÊ_ÌâåªÌÄåã__ÌâåªÌÄå_ÌÄåÝ *T_ÌÄåÛk_Ìâåµns* Ìâå___ [ pidtu.au-on.ru ] Ìâå_ÌÄå£ÌÄåÏ *T_ÌÄåÛk_Ìâåµns* _ÌâåªÌÄåãÌÄåÊ_ÌâåªÌÄåã__ÌâåªÌÄå_ÌÄåÝ
_ÌâåªÌÄåãÌÄåÊ_ÌâåªÌÄåã__ÌâåªÌÄå_ÌÄåÝ *T_ÌÄåÛkÌÄå_ÌÄå£ns* Ìâå___ [ pidtu.au-on.ru ] Ìâå_ÌÄå£ÌÄåÏ *T__kÌÄå_ÌÄå£ns* _ÌâåªÌÄåãÌÄåÊ_ÌâåªÌÄåã__ÌâåªÌÄå_ÌÄåÝ



*_Ìâå¢_ÌÄå¤klimak_ÌÄå¤n N_Ìâåµtwork* is _ÌÄå¤ _ÌÄå»l_ÌÄåÛÌâåÜÌâåÌÄå¥Ìâå£kch_ÌÄå¤in-b_ÌÄå¤sÌÄå_ÌÄå£d inv_Ìâåµstm_Ìâåµnt _ÌÄå¤nd ÌÄå_ÌÄå£duÌâåÜÌâå_ÌÄå¤ti__n_ÌÄå¤l busin_Ìâåµss pl_ÌÄå¤tf__rm f__r ÌâåÜÌâårÌâåÜÌÄåÝÌâåÜÌâåÑtoÌâåÜÌâåÌÄå¥Ìâå£urrÌÄå_ÌÄå£ncÌÄå¥Ìâå£ÌâåÜÌÄåÝ inv_Ìâåµst_ÌÄåÛrs, tradÌÄå_ÌÄå£rs _ÌÄå¤nd _ÌÄå¤n_ÌÄå¤lÌâåÜÌÄåÝsts. _Ìâå_latf__rm _ÌÄåÛff_Ìâåµrs trading sign__ls, str_ÌÄå¤tÌÄå_ÌÄå£giÌÄå_ÌÄå£s _ÌÄå¤nd rÌÄå_ÌÄå£c__mmÌÄå_ÌÄå£ndati_ÌÄåÛns fr_ÌÄåÛm ÌâåÜÌâåÑÌÄå¥Ìâå£r__f_Ìâåµssi__n_ÌÄå¤ls s_Ìâåµnt exÌâåÜÌâåÌÄå¥Ìâå£lusivÌÄå_ÌÄå£lÌâåÜÌÄåÝ t__ ÌâåÜÌâåÑl_ÌÄå¤tf_ÌÄåÛrm us_Ìâåµrs. Visit w_Ìâåµbsit_Ìâåµ f_ÌÄåÛr m_ÌÄåÛr_Ìâåµ inf__rm_ÌÄå¤ti_ÌÄåÛn - Ìâå___ [ pidtu.au-on.ru ] Ìâå_ÌÄå£ÌÄåÏ","4/22/18"
"1353",1353,1353,"tdsm19",0,"Kiki Glazebrook I looked up what a troll is, just to make sure. I'm exactly who I say I am, my purpose in this thread is to educate, and I would say the exact same thing if these people were sitting in front of me. 

I'm just sick and tired of seeing people gaslight the truth. I used to be a card carrying NRA member, in the 80s and part of the 90s. I watched the NRA go from being all about gun education, to Charlton Heston saying they'd ""pry his gun from his cold, dead fingers"". That's when I quit. All I wanted was to defend my home, as a single woman, not to be a gunslinger.

I only own black powder guns now, and they're still kept in my safe. They're all inherited heirlooms, or I'd get rid of them as well. I don't want my grandkids getting a hold of a gun that a video game would teach them how to load. I thank the good Lord that my kids never got a hold of my semi-automatic guns when I still had them. 

Another significant event happened in my life, that changed my feelings about guns. My own brother bought a gun because he was scared after firing an employee. A year later, he got very drunk and shot his girlfriend in the head, then put the gun in his mouth, killing him instantly. 

When he first showed me the gun, the way he bragged about it gave me a bad feeling, as though nothing good would come of it. So, no. I don't think everyone should have a gun. He was sane, but, he was a binge drinker. 

To me, what these kids are asking isn't quite enough, but it's a damn good start. I'll do anything I can to support them.","4/17/18"
"1354",1354,1354,"Kiki Glazebrook",0,"tdsm19 you're trolling_ÌâåªÌâåÉÌÄå__ÌâåªÌâåÉÌÄå_","4/17/18"
"1355",1355,1355,"Charis Ralph",0,"I WOULD LOVE TO SEE THE OTHER INMATES BEAT YOU UP EVERY DAY CRUZ YOU NEED A HARSH BEATING FOR KILLING 17 INNOCENT PEOPLE FOR NO REASON","4/22/18"
"1356",1356,1356,"Charis Ralph",0,"WELL CRUZ WHY DID YOU KILL 17 INNOCENT PEOPLE FOR NO STUPID REASON CRUZ YOU STUPID JERK YOU SHOULD GET A BEATING BY THE OTHER INMATES","4/22/18"
"1357",1357,1357,"CrÌâåÕÌÄå´me BrÌâåÕÌâå_lÌâåÕÌâå©e",0,"Youre charging this guy for murder to set an example that murder is morally wrong, and to do that you plan to murder him.","4/22/18"
"1358",1358,1358,"chilled sama dio",0,"That poor kid","4/22/18"
"1359",1359,1359,"black horse",0,":D
die in pain motherfucker!","4/21/18"
"1360",1360,1360,"Juli stole your Man",0,"FUCK HIM HE DESERVES TO DIE A SLOW PAINFUL DEATH FUCK OFF WIT THIS HE IS SICK LIKE IDGAF THST PUSSY HAD ENOUGH MENTAL CAPACITY TO PLAN AND KILL 17 INNOCENT PEOPLE IN FACT WHY TF IS HE BEING CHANGED AS A KID GE IS 19 FUCKING YEARS OLD FUCK HIM","4/21/18"
"1361",1361,1361,"Jamie Shaughnessy",0,"Never made it to a correctional school huh","4/21/18"
"1362",1362,1362,"NeverSleep Jones",0,"It took them this fuckin long to Say This!","4/20/18"
"1363",1363,1363,"Macca Dundee",0,"Put him in the chair","4/20/18"
"1364",1364,1364,"AlexHector",0,"FUCK THIS MOTHER FUCKED BY SATAN.","4/20/18"
"1365",1365,1365,"Stella Maris",1,"""Many that live deserve death. And some that die deserve life. Can you give it to them? Then do not be too eager to deal out death in judgement.""

Ìâå_ÌâåÑÌâåÇ J. R. R. Tolkien, The Fellowship of the Ring","4/19/18"
"1366",1366,1366,"Timogen Viente",0,"Hot judge","4/19/18"
"1367",1367,1367,"iscreamman02",0,"Judge is hot.. oh yea r.i.p. students. Justice was served...","4/19/18"
"1368",1368,1368,"Louie Gimena",0,"What's wrong with white kids nowadays? Too much gta and shit eh?","4/19/18"
"1369",1369,1369,"November SAINT",0,"DEATH BY HANGING. HE HAS CHOSEN HIS PLACE IN SOCIETY","4/19/18"
"1370",1370,1370,"Jaime MuÌâåÕÌâå±iz",0,"They need to just put him down like a dog","4/19/18"
"1371",1371,1371,"DANIELCOVEYVEVO",0,"Kill him kill him","4/18/18"
"1372",1372,1372,"L'Quik Shrtz",0,"Fucking idiot","4/18/18"
"1373",1373,1373,"Plug Nation",0,"Stone this piece of shit to death","4/18/18"
"1374",1374,1374,"I amblackman",0,"So what I gotta do to end up in her court , I'll kick a few kids in the face","4/18/18"
"1375",1375,1375,"I amblackman",0,"I just wanna smash the judge","4/18/18"
"1376",1376,1376,"Justin Puyear",0,"Hmmm. A school shooter facing the death penalty. Ya donÌâå_ÌâåÑÌÄåöt say?.....","4/18/18"
"1377",1377,1377,"Just Lewie",0,"Boi I know this man ain't wearing no flip-flops","4/18/18"
"1378",1378,1378,"bamsefunXD1234567890",0,"ive never seen such a hot judge before","4/18/18"
"1379",1379,1379,"Sim Cruz",0,"there goes my last name","4/18/18"
"1380",1380,1380,"John Winston",0,"Fucking piece of shit ain't nothing but the devil in disguise!!!!!_ÌâåªÌÄå»ÌÄåÛ_ÌâåªÌÄå»ÌÄåÛ_ÌâåªÌÄå»ÌÄåÛ_ÌâåªÌÄå»ÌÄåÛ_ÌâåªÌÄå»ÌÄåÛ","4/17/18"
"1381",1381,1381,"John Winston",0,"I hope that sorry motherfucker dies in prison!!!!!!_ÌâåªÌÄå»ÌÄåÛ_ÌâåªÌÄå»ÌÄåÛ_ÌâåªÌÄå»ÌÄåÛ_ÌâåªÌÄå»ÌÄåÛ_ÌâåªÌÄå»ÌÄåÛ","4/17/18"
"1382",1382,1382,"Twisted Soul",0,"Ìâå_ÌâåÑÌâåÒFuckÌâå_ÌâåÑÌâåthe judge ,kill the dog hell yeah","4/17/18"
"1383",1383,1383,"Sticker Happy",0,"Remember kids if you shoot up your school kill yourself afterwards","4/17/18"
"1384",1384,1384,"dark soul",0,"I feel sorry for him","4/17/18"
"1385",1385,1385,"M Meah",0,"If he converts to Islam while in prison does he go from mentally ill to a terrorist?","4/17/18"
"1386",1386,1386,"sonic static",0,"I'd fuck the shit out that judge","4/16/18"
"1387",1387,1387,"Kyle",0,"That judge is hot","4/16/18"
"1388",1388,1388,"NBforever 23",1,"My idol","4/16/18"
"1389",1389,1389,"NBforever 23",0,"Judegeyis super hot","4/16/18"
"1390",1390,1390,"The Joker Channel",1,"Death penalty is too good for him...","4/16/18"
"1391",1391,1391,"Sami Gebremichael",0,"Think about this . Why do you hate Nicholas Cruz . He did nothing to you . Seriously think about it","4/16/18"
"1392",1392,1392,"KingJ",0,"Kill that mother fucker","4/16/18"
"1393",1393,1393,"Guy Manson",0,"The lack of empathy in this comments section makes me sick","4/16/18"
"1394",1394,1394,"biccy the soggy owl",1,"Is it just me or am I getting a kind of autistic vibe from him?","4/16/18"
"1395",1395,1395,"biccy the soggy owl",1,"rip","4/16/18"
"1396",1396,1396,"anonymous kust",0,"The killer in norway in 2011 killed 69 people. #norwayisfuckedup he  got 25 years in jail search Breivik on youtube","4/15/18"
"1397",1397,1397,"sano fv",0,"this is actually so sad","4/15/18"
"1398",1398,1398,"NeGrotOloGY Inc.",0,"That judge can sentence me any day main","4/15/18"
"1399",1399,1399,"Ric Aldrich",0,"When are the cops and FBI going to be charged for doing NOTHING!","4/15/18"
"1400",1400,1400,"reverse autopsy",0,"fell sorry for the kid... if only he could of killed more students and teachers... I hope his evol cunsumes someone elses heart. kurva elet nem sobad hogy ot legeyl... magy a vered masokra ish oda sal.","4/15/18"
"1401",1401,1401,"l stfu you just died",0,"Burn him alive","4/14/18"
"1402",1402,1402,"MrSportsFan88",0,"DonÌâå_ÌâåÑÌÄåöt execute him make him rot and rot and stare at a wall all day for the rest of his life..","4/14/18"
"1403",1403,1403,"Darth Sheevious",0,"I honestly want to see him die slowly and painfully. He deserves it","4/14/18"
"1404",1404,1404,"D R E A M S",0,"What a pussy...","4/14/18"
"1405",1405,1405,"FuckTrump2018 Trump2018",0,"Isn't it that one kid that shot up that one school in Florida??","4/14/18"
"1406",1406,1406,"Can i get 200k With no vids",0,"NOOOOOOOO DEATH IS TO EASY LET HIM GET HIS ASS RAPED IN JAIL","4/14/18"
"1407",1407,1407,"Masochistic Suicidie",0,"So what....nobody is talking about this other shooter? Many eye witnesses say there were two shooters. One wearing full armor.  Even a helmet but I guess this is just....it.

Shit is so fucking wrong","4/14/18"
"1408",1408,1408,"MemoryLaneCinema",0,"pathetic little dude hiding behind a gun. Hot judge though","4/14/18"
"1409",1409,1409,"Jacka Lacka",0,"Off with his head.","4/13/18"
"1410",1410,1410,"Azor Ahai",0,"_ÌâåªÌâåÉÌÄå¢ Jesus Christ... I canÌâå_ÌâåÑÌÄåöt even fathom what would make someone go to a school and shoot children. May god not have mercy on his wretched soul.","4/13/18"
"1411",1411,1411,"Death Is Pure Bliss",0,"I hope he gets out of jail and comes my way.","4/13/18"
"1412",1412,1412,"Tryhard Togood4u",0,"guys dont u think all shooters should be put on death penalty especially shooters who shoot up liltte kids the should get lethal injection","4/12/18"
"1413",1413,1413,"Gratest Ever",0,"IÌâå_ÌâåÑÌÄåöm glad Anthony is alive we played soccer together","4/12/18"
"1414",1414,1414,"Joe McGuire",0,"He is going to be murdered in prison, I hope he knows that","4/12/18"
"1415",1415,1415,"Dylan Meikle",0,"Don't punish murder with murder","4/12/18"
"1416",1416,1416,"Nik SlapniÌÄå_Ìâåar",0,"I would 100% rather fuck his lawyer so fucking hot middle age milf, I bet she rides and swallows dicks so good","4/11/18"
"1417",1417,1417,"Lucky S",1,"Why plead not guilty? 

Some one it's because he didn't actually do it. There have been conflicting reports, several witnesses reported 2 men, others reported a man in a mask, and some kids reported seeing Cruz as gunshots were still going off.","4/11/18"
"1418",1418,1418,"Skyla Vega",0,"That judge can lock me up and throw away the key any day","4/11/18"
"1419",1419,1419,"Kathy Love Queen",0,"Nooo , dont kill him he killed 27 people but only GOD can take peoples life cus he gave it to u","4/11/18"
"1420",1420,1420,"Lucy The Cat",0,"Hell yeah my boy Nikolas Cruz!!!","4/11/18"
"1421",1421,1421,"yacine dz",0,"Stop selling guns, or kill the criminals and dont give them a chance to live in prison doing push ups and squats....","4/10/18"
"1422",1422,1422,"In Allah We Trust",0,"Thank God He was NOT a Muslim!
Otherwise he would be called a terrorist and worse than that even his religion would be insulted and all the Muslims would be suffered!
#TerrorismHasNoReligion","4/10/18"
"1423",1423,1423,"PrimeTime",0,"damn that judge is fine af","4/10/18"
"1424",1424,1424,"Just A Metalhead",0,"What the fuck is up with all these school shootings!? Everyone's fucking dumb in the US? Legit the kid saw a school shooting and was like ""oh that's hella cool, I wonder what could go wrong _Ìâåª_ÌâåÓ..."" or what??






*???*","4/10/18"
"1425",1425,1425,"Dark Angel",0,"Death sentence plz","4/10/18"
"1426",1426,1426,"Mattheo B",0,"Death sentence for that piece of shit..","4/10/18"
"1427",1427,1427,"Lethal Savage",0,"If this was the medieval times, this dude would be dead by know","4/10/18"
"1428",1428,1428,"Allsaints Church",0,"HAHA THATS WHAT YOU GET WHITE BOYY WANNA GO AROUND KILLINN PPL U FUCKING PSYCHO","4/9/18"
"1429",1429,1429,"Yariel Cruz",0,"For him to share the name Cruz. Its a fucking embarrassment to know I share the same last name as him.","4/9/18"
"1430",1430,1430,"Wyatt Pike",0,"Fuck yes that physcio is getting the death penalty fuck yws","4/9/18"
"1431",1431,1431,"SlidewaysKenny",0,"He didnÌâå_ÌâåÑÌÄåöt do it","4/9/18"
"1432",1432,1432,"Huskerturtles11 awb",0,"He should not in prison","4/9/18"
"1433",1433,1433,"Chalkzone0",0,"I blame black people. Kill niggers","4/8/18"
"1434",1434,1434,"Jessie Hamer",0,"Please show footage of every day he gets fucked up on prison","4/8/18"
"1435",1435,1435,"Gdhdhd Bdbdhd",0,"White people","4/8/18"
"1436",1436,1436,"clorox Bleach Father",0,"He doesn't deserve an attorney.","4/8/18"
