"","X.1","X","all_comments.authorDisplayName","all_comments.likeCount","all_comments.textOriginal","all_comments.publishedAt"
"516",516,516,"The best mora Mora",1,"Do you know what we should do we should not give shooters attention because I thinks that is what they want","4/3/18"
"517",517,517,"aboveforever",0,"Look, if you need to kill someone, quite killing innocent people.ÌÄå_Ìâå_ÌÄå_Ìâå_Maybe it would be better to goÌÄå_Ìâå_kill someone at CNN, ABC or NBC.ÌÄå_Ìâå_ These MSM people are enemies of the state.ÌÄå_Ìâå_ They are traitors to the country.ÌÄå_Ìâå_ What is usually done with traitors?","4/3/18"
"518",518,518,"tiffany zavala",0,"what is wrong with the world no one can live one day with peace","4/3/18"
"519",519,519,"Repression Ourworld",1,"This happened at my school","4/3/18"
"520",520,520,"Gisselle cabrera cortez",0,"OMG I WELL KILL THE EVIL GUY THAT KILLED THOSE POOR KIDS","4/3/18"
"521",521,521,"ewdryk",0,"Fear the nobodies.","4/3/18"
"522",522,522,"Jacob Ramirez",0,"Terrorists do this kind of stuff.","4/3/18"
"523",523,523,"SUH SUH G",0,"Noice","4/2/18"
"524",524,524,"Meggy Burman",0,"The shooter can die in hell his live is no need in GodÌâå_ÌâåÑÌÄåös eyeÌâå_ÌâåÑÌÄåös","4/2/18"
"525",525,525,"Maxy Ko",0,"(Sigh) my freind she was in that school and moved schools a day before this happened","4/2/18"
"526",526,526,"Tatsumaki The Frappe",4,"lol, guess it wasn't their lucky day","4/2/18"
"527",527,527,"Hungry Pusheen",0,"Listen to Found Tonight. Its in honor of all people affected any shootings anywhere. Stay strong! Tomorrow they'll be more of us! <3","4/2/18"
"528",528,528,"MAH FACE",0,"AHHHHHH","4/2/18"
"529",529,529,"Jesse Davis",0,"you don't see black kids doing this type of stuff","4/2/18"
"530",530,530,"Savage",0,"Punk ass bitch should 
be sent to hell","4/2/18"
"531",531,531,"Fatmir Lopari",0,"Their cries......_ÌâåªÌâåÉ__ÌâåªÌâåÉ_","4/2/18"
"532",532,532,"Gee Cee",0,"Teachers were told it was going to be a drill. Fire alarm goes off & female teacher sees a police officer, in full tactical gear, shooting people. In another video, police are seen loading a limp body onto a white pickup, Nicolas Cruz, then Cruz is arrested in jeans & red shirt totally unconscious. This was a coordinated effort by FBI, COWARD County sheriff's dept. & David Hogg. Start using your brains SHEEPLE, connect the dots. Hoggs statements are bullshit. ""I rode to school as soon as I heard the news"" / ""I was there when it happened"" / ""The suspect is Nicolas Cruz"" while huddled under some stairs, BEFORE CRUZ WAS EVEN SUSPECTED. CROCK OF SHIT, HITLER YOUTH.","4/2/18"
"533",533,533,"zaizo V",0,"you kids better start learning self defence plus weapons training . and if any student turns on their peers, kill that cunt dont wait for the cops to come . 

all this shooting drama is probably set up take away the guns from people. i mean the good people .","4/2/18"
"534",534,534,"KaylaTheIronFist",0,"Things like These need to stop now the only solution is not to put more restrictions on guns, we need to question who is pulling the trigger and what we can do to help and how prevent any more school shootings or any public shootings. All my prayers to the victims and their friends and families Ìâå_Ìâå_Ìâå«ÌÄåªÌâå","4/2/18"
"535",535,535,"Eagle",0,"Take a gun home and take the devil with you.","4/2/18"
"536",536,536,"Inpost",0,"i wouldve punched 2 windows in with a few other people and ran away, its better to break a few bones getting down from the windows than to get shot and die","4/2/18"
"537",537,537,"SolÌâåÕ_ ÌâåÕÌâåolÌâåÕÌâåâ",0,"no actual eye witness or camera footage of the school shooter","4/2/18"
"538",538,538,"Nina * Angels On Earth",0,"The cries are heart breaking....I am crying hysterically as the girls cried. I feel so bad for them...","4/2/18"
"539",539,539,"Aussie Legend15",0,"3:34 was that a body","4/2/18"
"540",540,540,"Xper Gaming",0,"I'm glad that owning a gun ( until you are an adult) is illegal in my country. but man those gunfire sound were  scary _ÌâåªÌâåÉ__ÌâåªÌâåÉ_","4/2/18"
"541",541,541,"Paul Colson",0,"I would urge people to look at the United States of America scool shootings alone since recorded school shootings time And then  tell me it's an ""epidemic"" These shootings are just very far and few between and mostly done with either melee weapons or hand guns. The real epidemic is the ones trying to change our second amendment.... Do your own research
https://en.wikipedia.org/wiki/List_of_school_shootings_in_the_United_States","4/2/18"
"542",542,542,"Ice Cream Sandwich",0,"Safety tips if there was a shooting in the school
1.Grab a book
2.Grab a fire extinguisher (idk if i spell'd that right)
3.Grab a pen or something Sharp
4.Throw the book at her/him to warn her/him
5.If he/her Shoots Use the fire extinguisher to blind him/her
6.Pretend to be like a ninja! Grab a pen or something sharp
-sneaky
-silent
After that Use the pen or anything thats sharp to stab him/her Done!","4/2/18"
"543",543,543,"Legit Calvin",0,"Hearts out to the victims and their parents, I hope all of them made it. Edit: if not, I hope they are in the heavens amen.","4/2/18"
"544",544,544,"Bonnie Z",0,"Donald trump is a cunt","4/2/18"
"545",545,545,"Steven Grant",0,"All of those cops hiding behind their cars, saddening...","4/2/18"
"546",546,546,"paul johnson",0,"Cruz was carried out of the school, unconscious, and is being used as a Patsy. #HoggWash","4/2/18"
"547",547,547,"Weird Person",0,"Me watching while going to school I'm scared","4/2/18"
"548",548,548,"Aliss sweet pie",0,"I was there. My heart was gonna pass! I cryed and cryed. The shooter was my old friend . I hope his dead now","4/2/18"
"549",549,549,"ChanceBaylor",0,"Hey! I have a idea why don't we stop blaming the guns and blame the school shooter and blame the fucking people who could've stopped it. Why don't we make it so bullying can be reduced and people won't go around killing people in schools? OH and why don't we stop making excuses for the people and start to help them in a mental way?","4/2/18"
"550",550,550,"The kÌâå_ÌâåÑÌÄåös 2037",1,"I feel for the families that are hurt by this but we have stupid people that wonÌâå_ÌâåÑÌÄåöt do anything about gun control!!","4/2/18"
"551",551,551,"Rashed Ghanem",1,"Qho came here from StoryBooth? XD","4/2/18"
"552",552,552,"redwingswinthecup14",0,"Why do school shooters always have the worst aim?","4/2/18"
"553",553,553,"Annii Desii",0,"Oh god on my school never is going to happen dat cuz we have a lot of security a lot a lot and we have a lot of teachers and my school on the entrance itÌâå_ÌâåÑÌÄåös locked and closed with a lock and the door itÌâå_ÌâåÑÌÄåös metal itÌâå_ÌâåÑÌÄåös not glass","4/2/18"
"554",554,554,"Adrian Shephard",0,"*Robert's got a quick hand
He'll look around the room, he won't tell you his plan
He's got a rolled cigarette, hanging out his mouth he's a cowboy kid
Yeah found a six shooter gun
In his dad's closet hidden oh in a box of fun things, I don't even know what
But he's coming for you, yeah he's coming for you
All the other kids with the pumped up kicks
You'd better run, better run, out run my gun
All the other kids with the pumped up kicks
You'd better run, better run, faster than my bullet
All the other kids with the pumped up kicks
You'd better run, better run, out run my gun
All the other kids with the pumped up kicks
You'd better run, better run, faster than my bullet
Daddy works a long day
He be coming home late, he's coming home late
And he's bringing me a surprise
'Cause dinner's in the kitchen and it's packed in ice
I've waited for a long time
Yeah the slight of my hand is now a quick pull trigger
I reason with my cigarette
And say your hair's on fire, you must have lost your wits, yeah
All the other kids with the pumped up kicks
You'd better run, better run, out run my gun
All the other kids with the pumped up kicks
You'd better run, better run, faster than my bullet
All the other kids with the pumped up kicks
You'd better run, better run, out run my gun
All the other kids with the pumped up kicks
You'd better run, better run, faster than my bullet
All the other kids with the pumped up kicks
You'd better run, better run, out run my gun
All the other kids with the pumped up kicks
You'd better run, better run, faster than my bullet
All the other kids with the pumped up kicks
You'd better run, better run, out run my gun
All the other kids with the pumped up kicks
You'd better run, better run, faster than my bullet
All the other kids with the pumped up kicks
You'd better run, better run, out run my gun
All the other kids with the pumped up kicks
You'd better run, better run, faster than my bullet*","4/1/18"
"555",555,555,"Burak Sarikaya",0,"4:39 what a Call Of Duty fan would wear.","4/1/18"
"556",556,556,"Marco Morales",0,"These personas dont diserve  this","4/1/18"
"557",557,557,"Bartos bela",0,"WARNING thereÌâå_ÌâåÑÌÄåös dead bodies and blood everywhere","4/1/18"
"558",558,558,"Bartos bela",0,"Cops are heroÌâå_ÌâåÑÌÄåös they saved their lives some of them died which are in heaven pray for them and R I P for them who died but now that guy is in prison thank god that he saved our lives","4/1/18"
"559",559,559,"mehdi LACROIX-cherouk",0,"I am french, how can you live with such violence in the USA ?
As a french, it leaves me totally without voice ! 
mass shooting never happened here, (only hunters can possess guns.).
I want also to send the expression of sympathy and brotherhood to the victims of Las Vegas.
Is there no way to prevent all that ?
 There must exist already some kind of filing of all those madmen, if not it is really time to
put it on !
May all those schoolboys rest in peace .","4/1/18"
"560",560,560,"Bethany Cartwright",0,"does this happen in england","4/1/18"
"561",561,561,"Knight Slayer",0,"My mom told me that the shooter will set the fire alarm to ring for the y can get out and shoot them so never go out first","4/1/18"
"562",562,562,"Feather The Wolf",0,"IÌâå_ÌâåÑÌÄåöm going to a huge high school next year and IÌâå_ÌâåÑÌÄåöm terrified this will happen to my school","4/1/18"
"563",563,563,"SCP-O5-council TheSCPfoundation",0,"Kinda funny that the shooter looks like a tard.","4/1/18"
"564",564,564,"the beautiful girl is here",0,"Lia Larsen that's not me my brother did that we share phone his mean about commenting","4/21/18"
"565",565,565,"Lia Larsen",0,"I get that you are trying to make a joke but this is not a funny subject.","4/21/18"
"566",566,566,"Long foot daddy 57",0,"I donÌâå_ÌâåÑÌÄåöt get it","4/20/18"
"567",567,567,"the beautiful girl is here",1,"Muzle shut the fuck up if you there I'm ganna laugh so hard hahaha.... _ÌâåªÌâåÉÌâåÔ_ÌâåªÌâåÉÌÄå»_ÌâåªÌâåÉÌÄå»_ÌâåªÌâåÉÌÄå»","4/20/18"
"568",568,568,"Anonymous",0,"Muzle becuse why even try when people import guns form other states or make it them self","4/20/18"
"569",569,569,"weeb cunt",0,"My god that's priceless attention really you know people have motivation's other then attention god so ignorant.","4/18/18"
"570",570,570,"ItsMeDylan TV",0,"Repression Ourworld a shooting?!","4/19/18"
"571",571,571,"whoareyou",0,"Tatsumaki The Frappe You dont fucking say? Maybe if you were stuck in this situation you wouldnÌâå_ÌâåÑÌÄåöt be laughing, bitch.","4/21/18"
"572",572,572,"weeb cunt",0,"Tatsumaki The Frappe true lol","4/18/18"
"573",573,573,"The kÌâå_ÌâåÑÌÄåös 2037",0,"Free Supreme nah man","4/5/18"
"574",574,574,"Free Supreme",0,"The kÌâå_ÌâåÑÌÄåös 2037 nah its the retarded kids and parents if youre getting bullied or some shit dont shoot up the school tell it or handle it but this?","4/4/18"
"575",575,575,"wind sindy",0,"Nicoulous cruz should live his life in  jail","4/1/18"
"576",576,576,"Maria Santos",0,"Nickolas cruz you are one","4/1/18"
"577",577,577,"Maria Santos",1,"So many people  died I fell sad and  hurts inside. There such pretty  grlis  that didn't  survive. Pray for all those tees  who have died","4/1/18"
"578",578,578,"Intro Maker",0,"They said Good morning even though it's a Bad morning..._ÌâåªÌâåÉÌÄå__ÌâåªÌâåÉÌÄå_","4/1/18"
"579",579,579,"Amaia Skye",0,"I pray for the students in that school","4/1/18"
"580",580,580,"Claire Hoggarth",0,"I fell so bad for the people that had put up with this xx_ÌâåªÌâåÉ__ÌâåªÌâåÉ__ÌâåªÌâåÉ__ÌâåªÌâåÉ_","4/1/18"
"581",581,581,"Derpy Lerpy",0,"I wish that shooter will be tortured and will always feel pain.","4/1/18"
"582",582,582,"Lauren Mason",0,"those videos are...horrifying","4/1/18"
"583",583,583,"BABUSHKA",0,"All the other kid's with the pumped up kicks.","4/1/18"
"584",584,584,"Hydrotoxic GT",0,"If there was a school shooting in my school I would wait for the best time for me and my friends to strike the shooter and beat him up","4/1/18"
"585",585,585,"Hydrotoxic GT",0,"Oh my this is very bad. I feel very sorry for everyone who died. May that shooter be punished for his mistake","4/1/18"
"586",586,586,"Jeffy Jeffy",0,"Now every time a fire drill gets pulled IÌâå_ÌâåÑÌÄåöm scared","4/1/18"
"587",587,587,"Jeffy Jeffy",0,"One day before this happened I had a drill and one day after i had a lockdown","4/1/18"
"588",588,588,"Skylar Jones",1,"Typical white people always wanna blame bullying and mental illnesses for shooting up schools,churches and everything else","4/1/18"
"589",589,589,"Ember & Pia best twins",0,"Oh my god i saw dis at storybooth","4/1/18"
"590",590,590,"Perk aholic",0,"it was my b day when this happened D:","4/1/18"
"591",591,591,"Emily Rose",13,"No child has to watch there own classmate or even best friend get shot right in front of them. No child needs to go through this at all..","4/1/18"
"592",592,592,"Maria Santos",0,"To who is going to died","4/1/18"
"593",593,593,"Pivotal Nobody",0,"Skylar Jones Whoa, why the fuck are you bringing race into this?","4/22/18"
"594",594,594,"Alyanna Marguerite HD",0,"i just hope people would also make dark humor jokes about your future death beacuse they are happy that you are dead for being an insensitive bitch fuck you","4/22/18"
"595",595,595,"Alyanna Marguerite HD",0,"Teddy Bear dark humor is nice but shit like this should be taken seriously with respect","4/22/18"
"596",596,596,"Alyanna Marguerite HD",0,"Idk memes thats true, but would you want to see your fellow students die because of violence? people can die peacefull and when the time is right and their deaths are way too early and not peaceful stfu","4/22/18"
"597",597,597,"Alyanna Marguerite HD",0,"ANTIV you can't even spell slaugthered right smh no wo der you hate school and just so you know, you're insensitive and i hope nobody cares when you die a gruesome death stfu","4/22/18"
"598",598,598,"DTrain LOLOLOLOL",1,"Idk memes lol you said Ìâå_ÌâåÑÌâåÒGood Morning Ìâå_ÌâåÑÌâå","4/21/18"
"599",599,599,"random kid",0,":,(","4/4/18"
"600",600,600,"whoareyou",1,"Epix Bitch. TheyÌâå_ÌâåÑÌÄåöre not lucky.","4/21/18"
"601",601,601,"Epix",0,"No the school shooting was something unlucky but no school for that long is lucky.","4/19/18"
"602",602,602,"ItsMeDylan TV",0,"Epix no like 3 weeks. Also they're not lucky AT ALL after that happened","4/19/18"
"603",603,603,"Dub Wilkinson",0,"whowereyou
your STUPIDITY is enormous not so your brain if one exist","4/22/18"
"604",604,604,"Dub Wilkinson",0,"whowereyou
i can see you are good at being VULGAR but have no REAL facts to express just misguided and
BRAINLESS EMOTION about LIES you chose to believe","4/22/18"
"605",605,605,"whoareyou",0,"Dub Wilkinson Fuck you. Shut the hell up. You will burn in fucking hell. Fuck yourself.","4/22/18"
"606",606,606,"Dub Wilkinson",0,"Sabrina R
there was no ACTUAL SHOOTING VICTIMS and it is me that understands the PAINFUL TRUTH 
any SYMPATHY  I have would go to the people that believe any LIES they are told without any
question even when the LIES are unbelievable 
http://www.dailymail.co.uk/news/article-5398997/Mother-reveals-daughter-survivor-Florida-shooting.html
https://www.youtube.com/watch?v=89UclS_8Xuo&t=915s
https://www.youtube.com/watch?v=WrmHNShgLCU
I dont make the LIES they do","4/22/18"
"607",607,607,"whoareyou",1,"Dub Wilkinson Maybe you should have more respect for these poor kids. There were kids on the floor fucking dead. You have no fucking heart. Screw you.","4/22/18"
"608",608,608,"Peanut Boyi",0,"Silvio Hrichi and if they do like it  then they would want the people to die.","4/13/18"
"609",609,609,"Peanut Boyi",0,"Silvio Hrichi, cause they don't like it when people die.","4/13/18"
"610",610,610,"NotMorne",0,"Officer2004 what a pussy","4/19/18"
"611",611,611,"John Montes",0,"More could have been saved had that cop not hid in the stairwell.","4/17/18"
"612",612,612,"Mingok",1,"Officer2004 lol pathetic","4/11/18"
"613",613,613,"Sophia Soto",0,"What is the video called?","4/7/18"
"614",614,614,"Caitlin B xo",1,"Alfieski no clue but after seeing that I really want a change to happen and IÌâå_ÌâåÑÌÄåöm ready to start trying for a change","4/7/18"
"615",615,615,"Alfieski",1,"Caitlin B xo 

Yea, I watched it 10 minutes ago and I'm shaking. Just wondering, by any chance do you know who that person was? My heart and prayers go to them....","4/7/18"
"616",616,616,"TurkeyWiing Guru",0,"No guns equals more weird weapons and or nukes","4/21/18"
"617",617,617,"NotMorne",0,"MoralSingularity europe has no gun violence and very strict gun laws","4/19/18"
"618",618,618,"John Montes",0,"Your government doesnt report it sven . Nor the rapes by migrants who hate you. Once the welfare state in your country collpases there will be more murders from angry migrants stuck there with no gibs.","4/17/18"
"619",619,619,"John Montes",0,"That worked for mexico or brazil. Or china where a mad man killed 30 CHILDREN with a knife.","4/17/18"
"620",620,620,"MayDay88 JoJo",0,"Because i seriously doubt criminals will turn in their guns bc of a ban. Its not the guns,its the person thats pulling the trigger","4/17/18"
"621",621,621,"Christian Torres",0,"Did you ever think why he did the whole shooting? Look into his backstory -_-","4/21/18"
"622",622,622,"Angie",0,"Dr8gon L7ght paul I totally agree and what really happened is that he shot because the school expelled him when he was younger so it was a revenge solution to himself but may god bless you and this world","4/21/18"
"623",623,623,"Angie",0,"ToastY ToasT oh really who made the earth you are blessed to ave a life I do not care if you believe in God or not but may god bless you and have a happy life","4/21/18"
"624",624,624,"Angie",0,"Ham by Turn I a agree","4/21/18"
"625",625,625,"Isaac Small",0,"I think so :D","4/21/18"
"626",626,626,"whoareyou",0,"luke potts Fuck you.","4/21/18"
"627",627,627,"Brando",0,"+Chewy Live
If we called on Jesus, it might stop, but we've gone secular, so don't expect any positive changes.","4/19/18"
"628",628,628,"Florjan Brudar",0,"Dina M This is why America is hated by people and has serious problems!","4/3/18"
"629",629,629,"H.M.H.S Britannic",0,"Candace Fortner you donÌâå_ÌâåÑÌÄåöt use any emojis over death","4/4/18"
"630",630,630,"Candace Fortner",0,"Bro this is obviously fake because you wouldnÌâå_ÌâåÑÌÄåöt just say Ìâå_ÌâåÑÌâåÒMy sis diedÌâå_ÌâåÑÌâå you would put sad emojis and rip itÌâå_ÌâåÑÌÄåös really fucking sad that your mocking this","4/4/18"
"631",631,631,"random kid",0,"I'm so sorry _ÌâåªÌâåÉÌâå¢_ÌâåªÌâåÉ__ÌâåªÌâåÉ_","4/4/18"
"632",632,632,"Savage Slitter",0,"GardevoirÌÄåÌâåÌâåÎÌÄå±_ÌâåÐÌÄåøÌÄå©ÌâåÎ nobody i guess","4/2/18"
"633",633,633,"GardevoirÌÄåÌâåÌâåÎÌÄå±_ÌâåÐÌÄåøÌÄå©ÌâåÎ",0,"Savage Slitter Who gives a fuck","4/2/18"
"634",634,634,"Savage Slitter",0,"GardevoirÌÄåÌâåÌâåÎÌÄå±_ÌâåÐÌÄåøÌÄå©ÌâåÎ im pretty sure if you weÌâå_ÌâåÑÌÄåöre in one of those class rooms bullshit would stop coming out of that mouth","4/2/18"
"635",635,635,"GardevoirÌÄåÌâåÌâåÎÌÄå±_ÌâåÐÌÄåøÌÄå©ÌâåÎ",0,"Savage Slitter i'm not judging dick","4/2/18"
"636",636,636,"Savage Slitter",0,"ChanceBaylor you do realize that all these opinions arenÌâå_ÌâåÑÌÄåöt gonna do shit right? Its up to the judge","4/2/18"
"637",637,637,"MightyCarrot",0,"look at his lip","4/18/18"
"638",638,638,"weeb cunt",0,"MightyCarrot look at this dude","4/18/18"
"639",639,639,"Christian Torres",0,"Unfortunately you're just an ignorant fool who never had Civics and look into people's backstory you emotionless fuck. His backstory was really sad","4/21/18"
"640",640,640,"kyasister 4 life",0,"DIY Queen and he got away with the murder","4/20/18"
"641",641,641,"John Montes",0,"Actually hunting rifles have more power then the gun he used. Many shooters choose this hunting rifle to get more attention simply because it is a black gun. Also you are all ignoring the fact the FBI ignored warnings. They've foiled domestic terrorist before but it seems they were too busy finding out if trump payed to have sex with a porn star or something..which nobody cared if he did.","4/17/18"
"642",642,642,"Thor, Son of Odin",1,"That won't change anything. People will just get it off the deep web","4/5/18"
"643",643,643,"Sharif Brown",3,"Mona Suzuki, while that is true, another reality is the students put the shooter through hell and now they had to face the consequences. Me personally, I don't feel bad for them.","4/4/18"
"644",644,644,"JJ Gamer",0,"Jose Silva it will be a Great year I promise *hugs*","4/21/18"
"645",645,645,"Honest Vega",0,"Jose Silva 
2018 is a busy year in my life.
No I'm not a grown up but I think this is what the year is","4/19/18"
"646",646,646,"freddy James",0,"Hahahahaha_ÌâåªÌâåÉÌÄå__ÌâåªÌâåÉÌÄå__ÌâåªÌâåÉÌÄå_","4/18/18"
"647",647,647,"Armani aka hops 90s kid smith",0,"Jose Silva not as bad as 2016.","4/13/18"
"648",648,648,"Reckno64",0,"Every year is worse than the last.....or so it seems.","4/11/18"
"649",649,649,"whoareyou",0,"Yep, that's exactly why.","4/20/18"
"650",650,650,"Spearwood ***",0,"He deserves to suffer.","4/19/18"
"651",651,651,"Jose Silva",0,"whoareyou WHAT","4/18/18"
"652",652,652,"whoareyou",0,"Jose Silva TheyÌâå_ÌâåÑÌÄåöre not giving him one, theyÌâå_ÌâåÑÌÄåöre making him suffer.","4/18/18"
"653",653,653,"Mastnaer Ceef",0,"O O F","4/2/18"
"654",654,654,"TurkeyWiing Guru",0,"Including blacks","4/21/18"
"655",655,655,"NotMorne",1,"Mingok its kind of not but HEY make your dreams come true","4/19/18"
"656",656,656,"A Youtube Account",0,"Sweet Niya ahhh there's always a reason","4/14/18"
"657",657,657,"Mingok",0,"Sweet Niya is that normal that i want to go to some town, shoot random people and cut their throats?","4/11/18"
"658",658,658,"Sled hijacker",0,"I feel bad for Nikolas Cruz, in the mindset he was in this was the only option he felt was right. I don't blame anything on him.","4/8/18"
"659",659,659,"Aesthetic Salmon",0,"Well, as a person with various mental problems, I wouldn't shoot a fucking school.

If they don't have guns, how will they shoot people with guns??? What????","4/21/18"
"660",660,660,"Lord of Cinder",0,"Burak Sarikaya takes one to know one you psychopath","4/20/18"
"661",661,661,"Lord of Cinder",0,"cm g yup","4/20/18"
"662",662,662,"Colin Hallett",1,"cm g you are sooo right bro, I have been bullied from my years in high school, and all I could think about is vengeance...","4/19/18"
"663",663,663,"Aryee Vang",0,"You are right.","4/18/18"
"664",664,664,"Creppy",1,"A bit too harsh, if you ask me, pump gang.","4/13/18"
"665",665,665,"pump gang",0,"leo fait la comÌâåÕÌâå©die Kill yourself","4/13/18"
"666",666,666,"Creppy",0,"What?I'm sorry, I can't understand you.","4/12/18"
"667",667,667,"leo fait la comÌâåÕÌâå©die",1,"Creppy when a student can come To school with gun. ..","4/12/18"
"668",668,668,"Creppy",0,"But why?","4/12/18"
"669",669,669,"Andy Milsten",0,"Daniel 22811 me too!!!","4/14/18"
"670",670,670,"Mingok",0,"Daniel 22811 peace is boring","4/11/18"
"671",671,671,"pump gang",2,"Daniel 22811 *hahaha FUCK OFF*","4/11/18"
"672",672,672,"ImperfectGun",0,"I really wish that too but there are some mentally ill people in the whole wide world it's nearly impossible to do that","4/8/18"
"673",673,673,"Parry Jungler",0,"ElH0mbreRico thats just implies how impulsive he is. He rather see the chaos caused by his actions at the risk of getting caught instead of running.","4/18/18"
"674",674,674,"theo mckenna",0,"pump gang _ÌâåªÌÄå»ÌâåÑ_ÌâåªÌâåÉÌÄå_","4/18/18"
"675",675,675,"ÌâåÀÌâåâÌâå»_ÌâåÀÌÄåâ ÌâåÀÌâåÎÌâå»_ÌâåÀÌâåÎÌâå»ÌÄåÏ",0,"Vera Wang not that new. My old high school had to cancel a fire drill for fear that a shooting was going to happen.","4/17/18"
"676",676,676,"ANTIV",0,"pump gang hahaha... dat fucked uo tho","4/16/18"
"677",677,677,"Lord of Cinder",0,"Vera Wang yet so clever","4/14/18"
"678",678,678,"Elizabeth Martinez",0,"Itzyogirlnicki:D we did something similar in my school cause I live in florida","4/18/18"
"679",679,679,"c0lor1zed",0,"ElH0mbreRico Seventeen faggots that did not deserve to die.","4/14/18"
"680",680,680,"ElH0mbreRico",0,"17 fags owned and humilliated kek","4/13/18"
"681",681,681,"c0lor1zed",0,"MoralSingularity now i know why u named urself that","4/5/18"
"682",682,682,"alexofficial",1,"fuck you all, death isn't a joke","4/15/18"
"683",683,683,"Gaming Wins",0,"Faris Zurub lmao","4/7/18"
"684",684,684,"Mingok",0,"Lilly Shearer why everyone in the comments are crying and shit?","4/11/18"
